tweet,hs
manusia tolol takut ahok kasihan hidup idiot and bodoh,1
bodoh question ngentot puasa goblok,1
baca artikel internet lembar berbeda menandai kebutuhan orang negeri pakai negara tetangga,0
bn etnic ai dipaksa tinggalkan budaya ai etnic han kekonyolan orang suku dipaksa pindah suku bn tragisnya warga ai korban penjualan organ tubuh dieksekusi dicap,0
tau dosen ilmu budaya sepuh ketemu penasaran mb,0
rakyat menolak keras indonesia dipimpin komplotan mafia bajingan,1
isu nongol bentar isu partai komunis indonesia,0
era susilo bambang yudhoyono pembangunan papua hambalang pembangunan perusahaan listrik negara mangkrak,1
vivin tai dasar perebut laki orang mengakui ale alda rico baj,1
,0
amanat ribu ulama by nama by address bilang cak imin ambisius mengopinya,0
rakyat merdeka on line gue bikin berita indonesia menang piala dunia kasih link kredibel alah pecundang culun menampilkan identitas aslinya berani bacot monyet handphone gue buatan korea coy ng,1
sesat cari jalan pagi maktab gaya jalan jalan pintas situ ditutup konstruksi hambar gila turn turn,0
maunya indonesia singapura kasih cina berkuasa dasar cebong otak reklamasi wkwk,1
bani coli beda junjungan,1
ikuti informasi terkini ekonomi keuangan perbankan investasi indonesia dunia,0
pengkhianatan partai komunis indonesia membunuh jenderal partai komunis indonesia keblinger karno bubarkan partai komunis indonesia turunkan harga bubarkan kabinet tritura,1
ih anjir bodoh bodoh,0
kentut bau babi,0
produksi indonesia presiden joko widodo ritel mal pindah plastik pilih belanja super aksi lingkungan,0
kenyataan bos suka bikin hoaks bani nabi ahoker,1
sayang ngentot,0
bangkai,1
kne jaga hati pemimpin kafir harbi kakak,0
abang ipar adam bangkai dasar penunggang agama,1
cina menguasai ekonomi media massa ayo usir indonesia,1
guru anak mengrkan spiritualitas sifatnya universal ran islam hindu kebanyn penduduk peradaban sindhu hindu beliau menerima jalan beliau memanggil allah,0
enak gesek memek,0
seulgi bilang mata barat kelopak matanya ketimuran gaya sipit seulgi pikir poin menarik,0
bambang noorsena ran kristen disalahpmi agama khotbah kristen,0
pikir kafir hanat,0
irnya asing asing,0
bicara sekolah,1
jablay mulu anjir,0
congor oknum nasional demokrat joko kalah indonesia bubar,1
sumbu pendek lelah,0
panik ahok kutil babi beli tumbang putaran teruskan cuap cuap mu media sosial berpengaruh,1
sinyal kartu three cacat ganti pakai kartu gaple,0
akun facebook asma dewi penyebar fitnah sara pemilihan kepala daerah jakarta dipenuhi foto politisi anies sandi,1
usir cina indonesia,1
facebook tai anjing,0
allahu akbar jokowi kenalkan islam moderat konferensi tingkat ulama cendekin muslim dunia,0
orang orang beriman masuklah islam ikuti lang setan qs,0
online income persh online income iklan iuran premium produk lost tax dibanding us mal menyerap ten kerja online diserap dipelihara wi,1
bani kampret menyamar lemparkan minyak babi,1
sabtu pagi masyart adat badui melanjutkan perjalanan kantor gubernur banten san pusat pemerintn provinsi banten kp curug kota serang sebabaduy,0
dungu rezim dungu klop,1
semoga istikamah nikita mirzani orang saleh malam kafir pagi istikamah perjuangan hidayah allah rsia mluk ber mendapatkannya,0
jaga jaga muncul partai komunis indonesia perjuangan alias partai komunis indonesia plus,1
dibenci munafik sukai orang,0
pao tui sisi kelam masyart cina era kemerden indonesia mantan wartn senior republika,0
ab orangnya sombong murah senyum,0
semangat istikamah,0
salah alasan presiden malu in bangsa iniiii,0
ulangi pandangan mu niscaya pandanganmu kepadamu menemukan cacat pandanganmu letih,0
on asing lini,0
ari melongo mendengar ucapan orang meneriakinya punten mas situ anjing,0
kupas tuntas gebuk habis antek antek komunis,1
logikanya kontrak habis minat bantuan bank asing akuisisi smnya asing masuk asing coba legowo kontrak habis duit sedikitpun bermain main,0
charutin menor bom,0
produk negeri dibilang alay produk dibilang hypebeast ironi giliran urusan negara bilangnya asing,0
chirpified ekonomi merosot utang beng badan usaha milik negara dijual mundur jokowi,1
kelojotan kegirangan junjungan idola dipanggil polisi politic id kepala kepolisian republik indonesia,1
dinding kamar saksi bisu,0
kepala badan ekonomi kreatif trin munafik lagu karya mengisn seekor burung bersiul memiliki melodi lirik riang kompas,0
gembrot,0
monggo bro jadwal acara upacara adat kirab budaya mbah bergas,0
sok kenal kunyuk,1
gus ipul mbak puti menciptn program program keluarga harapan super melengkapi program keluarga harapan program keluarga harapan dikembangkan presiden jokowi gus ipul puti menang,0
suruh ceritakan geblek,1
kemenangan anies sandi berbau busuk anyir bernanah luka batin terluka penghinaan sara ujaran kebencian,1
cacat,1
ulama barang bersedia bermalasan rejab aban malas ramadan malas,0
bikin berita media sosial media mainstream kuasai asing perang opini gunn handphone menggembosi berita media mainstream cina,0
pro asing jok,1
sipit cantik,0
ber tato entot kayaknya thailand enjoy gays kontol coli bncoli,0
coba usir cina rakyat negara kesatuan republik indonesia gembel negara kesatuan republik indonesia asing asing triliunan menguras negara kesatuan republik indonesia stop tolol,1
salah anggota hati sakit hati organisasi masyarakat bubarkan maju,1
didungukan diperbudak islam tifatul adam dongeng yahudi,1
cebong fitnah kenyang curang menang,1
perempuan gembrot melangsingkan badan ku setuju kalimat ku cantik selamat pagi lupa salat subuh,0
hebat penjara penjaranya zaman,1
asing dibelngnya,1
masya suku kampung selamat deklarasi anti hoaks pilihan kepala daerah damai,0
hati partai persatuan indonesia mmpraktennya msjid psantren huuuft kabuuurr ganti presiden ganti presiden,1
sejujurnya abang like anjing kucing gaduh orang gaduh bertumbuk then lari rumah selang sehari,0
atok silap atok hehe macai atok ler macai ph bodoh bangang rakyat tau penjelasan opsss atok,1
admin tolol partai tolol partai tolol orang tolol,1
keluarga partai komunis indonesia negara pancasila berbineka tunggal ika keluarga,0
sambutannya ketua dewan perwakilan daerah golkar lumng sudjatmiko keputusan partai menetapkan khofifah indar parnsa calon gubernur emil elestianto dardak calon il gubernur jawa timur partai golkar bulat khofifah,0
dasar kampang,1
manusia makhluk butuh identitas eksistensinya sayang identitas berasal orisinalitas kesadaran seringkali dilekatkan membabi buta remeh identitas dangkal,0
at taman budaya sentul city,0
kejamnya,0
sekolah katolik beragam anak kebun pengus later belng suku agama apapun diterima sekolah katolik mengalami berubah,0
subhanallah bgia pemimpin beliau,0
bersyukur allah subhanahu wa taala presiden giat kerja mengatasi dihadapi kerja lurus ikhlas indonesia maju ramping energinya,0
mudah condong arah sosial media akunnya perempuan gambar mencuri google gambar anonymous manusia kampret ketiga akunnya embel embel nama pahln kaum muslim cyber army,0
cpres jokowi orang tinggal presiden terbitkan dekrit partai pengusung jatah cpres jokowi peraturan pemerintah pengganti undang undang diterbitkan urgensinya,0
malas duduk orang kg budaya kg duduk budaya hebat seram,0
dientot dicrotin kontol uh,0
kualat bobby mata gue sipit,0
franky presiden,0
sekolah mulutnya jaga kotor sampah,1
anjing nama berisik cocot,1
tekan jabatan siasat lari lingkar politik antek pemilik modal islam progresif sesuai mukadimah undang undang dasar mengamalkan qs al hujurat,0
tomohon merupn pusat pembelran agama kristen katolik khusus berdoa meditasi bukit kasih suci indah tenang tomohon international flower festival,0
anies congornya gede realisasinya janji bisanya korupsi dosen bangsat,1
kesal kacrut televisi republik indonesia,1
suasana hati kerja berubah banci,1
kemarin kamis jumat sesingkat,0
pimpinan mencerocos bn nderomos jancuk deh,1
islam ideologi negara mengembannya ib menyebarkannya jihad as menyebarkan demokrasi ussr menyebarkan komunis karang jalan damai kadang perang syariat hukum syriyah rajiyah,0
aduh salah pm islam kafir dibedn kafir harbi muahid kafir dzimmi,0
dibs penangkapan ikan menggunn potas racun sampah plastik tugas tentara nasional indonesia al,0
anjir,0
terwujud dikarenn katolik terpusat terstruktur teroganisasi berpusat vatikan nu mengambil merebut peran vatikan mudah,0
bilang orang menghina agama kena hukum pidana orang menghina agama mayoritas tersinggung langsung dihujat dikenai hukum,0
kacung terima perintah terima kritikan semoga pemimpin simbol kacung kacung dikacung kacung terima kacung tunas subur semerbak harum bunga bangkai,1
merindukan soeharto kroni rezim soeharto penjual bangsanya,0
rsia bong koruptor rampok pelaku maksiat pelaku bisnis maksiat kaum lgbt penjilat dukun sesat dukun cabul nabila bla bla tergabung bani cebong,1
matanya buta alam maya hatinya buta menerima cya kebenaran alam,0
cebong pindah on masuk kemako brigade mobil,1
serius ngewe sumpah,0
teroris buddha pemerintah mengern cyber army bikin hoaks meretas akun akun pro rohingya,1
kamar guru musala kristen berdoa aula kristen teman kristen tolong guru ambilkan casan laptopnya tempatnya,0
partai keadilan sejahtera partai pelacur beyek germo nap partai keadilan sejahtera sadar susilo bambang yudhoyono otak dibalik kriminalisasi lhi politisi islam pengkhianatan prabowo hatta pelanggaran pemilihan presiden penghancuran citra islam partai keadilan sejahtera disusupi antek be,1
dear driver tukaran orang anter gue gue pintar dongok memuter cari rumah gue pakai driver pengganti dongok buang gue menunggu tai,1
memaki cebong kaum codot memainkan korban much,1
ikuti gue baca kiraan setan,0
orang islami membangun narasi pendapat berbeda liberal sekuler munafik antek asing,0
betah mnya kemarin desak majelis permusyawaratan rakyat sidang istimewa turunkan jokowi,1
mata gue sipit,0
gue normal member autis,0
najis berdua bully adik atip,1
buaya gede,0
teriak bubarkan partai komunis indonesia orang pulsa listrik rumahnya habis mengutuk orang ketidaktahuannya,1
tren konsumsi video bertumbuh data,0
lukman im saifuddin substansial kepercayaan agama,0
bajingan sebutan orang ah,1
allah mohon secepatnya ganti presiden biar indonesia selamat,0
pos paul pogba selebrasi gol terdengar tiruan suara monyet,0
pendukung prabowo surat pemberitahuan tahunan arb sda orang orang bejat tabiatnya kasar orang semoga dilaknat allah,1
tentara nasional indonesia nafsu ikutan pemerintn doktrin kekaryaan mnya dukung soekarno bubarkan parlemen dekrit,1
ekonomi moral menikah deh gue pakai akun tulisan nama antek asing gara gara asing congor negara gue hina tega,1
alucard,1
soeharto dalang bencong hehe,0
bubarkan komisi pemberantasan korupsi perkuat lembaga negara sistem politik,1
nayeon member kali suka ngepost instagram story suka bilang lesbi budak cinta kali,0
tubuhku kurus muda orang memiliki punggung tegap lebar matanya sipit tanda kelopaknya garis menggambarkan watak galak cont,0
pakcoy ih pacar kuuu,1
indosiar elang mahkota teknologi grup gembel menyiarkan bola,1
penampilan serasa suci sedunia kelakuan setan empati keluarga korban bom kemarin,1
cebong eh berudu ter faith accompli anies mencalonkan presiden gubernur hidup tenang nikmat gue mainkan cebong,1
tau pasukan nasi bungkus kasihan merasn daerah khusus ibukota daerah khusus ibukota harap bersabar cobaan,0
aduh lebay didik soeharto bob hasan menteri kabinet pembangunan jabatan maret mei bob hasan muhammad,0
kecuali manusia monyet mamalia buta warna,0
betapa biadabnya teroris buddha myanmar,1
rupiah haneul suka sepong kontol on retweet,0
kebaca onta semoga adik bayinya cowok nan modusin,0
mampus tembak silvy uruskan dapur program sukanya menyerang gue debatfinalpilkadt,1
ngentot sekretaris nurl cerita dewasa memek merah memek basah memenda,0
gue anjing penasaran berbicara maju garuda kuping budek,1
bro kitab suci fiksi agama yu pernyataan surat pemberitahuan tahunan mutlak harfiah filosofis melanggar keyakinan umat beragama konstitusi norma agama penista agama kotor ateis mati,1
sontoloyo sok iparan allah subhanahu wa taala,1
akibat putus cinta sbat dientot lubang rapat bool memek,0
deklarasi pilihan kepala daerah aman anti hoaks paguyuban budidaya lele jabon,0
ahok lantik gubernur anis anis gubernur,1
agama buddha kokoh peradaban masyart membangun candi luas candi sewu prambanan npd bersamaan penganut agama hindu utara membangun candi kalah besarnya,0
keras diln keras kung fu kadang pakai tai chi kelembutan mempergunn kekuatan ln,0
mulut buaya,0
hoaks pintar dungu bego kasihan pengikut ikutan dungu tolol,1
urusannya duit hitungan bisnisnya pemerintah indonesia untung tepuk tangan buntung risiko rezim model ketahuan harganya janjinya harga,0
plt isinya kerja polisi indonesia polisi tionghoa penjelasan polisinya tolak markas lihat fotonya selamatan,1
bela asma dewi bentuk solidaritas kekejaman rezim anti islam,1
tolol bela penista agama tersangka,1
minum kopi biar deg alias kocak bolotnya pas congor,0
hasil insinyur menyatn melindungi ahok terd penista agama,1
menarik menarik gatot nurmantyo bersaing jokowi pas tentara nasional indonesia aktif prabowo ditinggalkan,1
debat kampret otaknya rendam kencing onta,1
khofifah merupn srikandi nu menduduki kursi gubernur jawa timur didampingi emil dardak il bagus khofifah emil jawa timur,0
berl pikir nyeleneh tuhan ku ciptakan anjing babi kitab mengharamkan bn babi menyentuh kulit basah haram ku kesana baca,0
semalam pck pekerja cocot komersial,1
mu gue mengikuti beritanya bencong bencong yaelah,0
tomohon merupn pusat pembelran agama kristen katolik khusus berdoa meditasi bukit kasih suci indah tenang tomohon international flower festival nor,0
melokalisasi agama nu kalah kreatif kristen protestan indonesia kristen batak,0
iklanahot bikin darah mendidih bangsat penuh propaganda islam radikal,1
pbb pandangan signifikan bagus pasangan presiden incumbent meln gatot nurmantyo yusril,0
guys presiden blusuk dihampir pelosok negeri jokowi mendengar langsung keluhan warganya mengecek program pemerintah video pemimpin duduk rendah berdiri,0
warga badui selesai memperingati tradisi seba pendopo pemerintah kabupaten lebak dilanjutkan bertemu gubernur banten idin halim sabtu sebabaduy,0
setan,1
gue celeng bikin synna emosi mancing,0
cebong kelojotan til ganti presiden waras buatlah til mengamuk mengamuk karuan giliran presiden hina diam ganti presiden gantipresidenkacung,1
kampang,1
rezim tukang menipu hoaks anti kritik,1
cebong kopi eta harga harga mengakuinya beli padl berutang,1
tokoh politik berseberangan pemerintah berani bicara kasar etika prabowo berani bilang elite goblok maksud sekolah dimana oi presiden anggota dewan berani bilang kementerian agama bangsat,0
berpikir bayi tabung perpaduan sperma kampret onta diragukan,1
monyet sumber hidup,0
cebong telur berisik dasar kampret miskin,1
selamat sore twit presiden jokowi memimpin rapat terbatas ratas istana kepresidenan bogor rabu membs percepatan pelaksanaan berus online single submission online single submission poin arnnya simak,0
menyelesaikan impor alat utama sistem pertahanan brigade mobil mending mundur,1
good luck suka pusing budaya populer,0
nama gatot saptono al ththath status tersangka pemuftan mr dugaan pendukung anies sandi,1
jelang pilihan kepala daerah pemerintah kabupaten garut kebut cetak ribu kartu tanda penduduk,0
indonesia hebat indonesia dibanjiri tenaga kerja asing jokowi keren deh top presiden seumur hidup ayo dukung jokowi solo ganti presiden,1
anjing anjing orde tukang menipu malu mengaku ustaz,1
indosat tai,1
maiyah keamanan aman hadir maiyah prajurit keamanan belr mengamankan menyamankan membgin muhammad sapril,0
butuh presiden takut miskin harta hilang kuasa tahta,0
ayat dingajikan perintah perangi bunuh penggal kafir,1
komunis,0
,0
saudara mengaji semoga allah izinkan gus ipul mbak puti gubernur wakil gubernur jawa timur,0
puisi sukmti puisi sang iblis,1
jijik kunyuk,0
otaknya kesetaraan gender telanjang dasar mesum cacat,1
jamilah ih aisya lesbi ioi,0
bismillah superior printing harga ecer lgn polos print lusin lgn polos print bn serena dri fit pe sp info order pin fd wa instagram sri yono bolanet pilihan kepala daerah jersey sale jersey goes to festival thumb,0
udik kasihan ditiduri,1
menyaksikan petani masyart ulama pemerintah mendukung program kapal kemanusiaan suriah ton beras ahyudin presiden act yuk simak penjelasan lengkapnya video letshe,0
mesti diproyen asing nasionalis pancasilais pilih asing antek asing,1
bacot,1
tol berutang jepang jokowi layak mulkan turunkan jokowi,1
akulturasi agama daerah keniscayaan kristen berjalan berbarengan tradisi istilah kristen nusantara kristen kristen islam islam penyebutan isl,0
mengrkan mengaji ayat cocok penis penggal kafir membiadabkan,1
kirim foto kontol full tertarik video call,0
sombong tau he manusia sumber bau bau bau bau udel bau ketek congean korong cileuh bau kepala bau mulut bau karbit jengkolan comberan bangkai,0
melayani kontol security meeting room for the video,0
anjing tai goblok idiot bangsat monyet babi fuck kont kangen goblok tau kasar maaf,1
menang anies sandi usut komisi pemelihan daerah khusus ibukota telat kampanye intimidasi,1
gue tinggal beli batagor anjir ngaret,0
gue mute anjir,0
bang asing juragan,0
mampus anaknya langsung nongol,1
oum jodoh pakai pelet jepang dek efektif honda beat honda,0
berpeluang tokoh perubn lukman hidup allah subhanahu wa taala sesat,1
om jilati memek,0
anjir gue mengecek berkali kali cewek benaran cowok tau tipuan video asli cewek terlepas gender astaga semoga adek gue amin,0
niklan bego buatan partai bego pemilih bego,1
acak acn pahln kesiangan gagalkan kudeta partai komunis indonesia pi gelar pahln,0
kubu prabowo menilai negatif kebin jokowi pemilihan presiden,1
ngewe,0
kampang anjing,1
meeting meeting disuruh diam patung miskomunikasi somplak,1
biaya ambil alih mayoritas pt fi us miliar minimum utang perbankan asing pemegang mayoritas taro duit bangun smelter pemurnian pembangkit listrik biaya cave mini,0
anies ombudsman perilan ombudsman republik indonesia ombudsman ri ombudsman peri,0
lebay duda,1
presiden kelun minimnya publikasi asian games asiangames,0
angkat tradisi budaya rakyat banyuwangi kunci kesuksesan bec,0
oh iyakan pas acara tempo ngeilin tim sukses anies sandi indra piliang tukang narkoba,1
cowok hobi swafoto beda lekong banci kaleng,1
salah menyebut keberserahdirian menteri agama ekspresi tuhan melayani sembah,1
dipungkiri rezim jokowi rezim anti islam,1
cebong kampret bilang infrastruktur jalan teruskan ml,1
amerika orang tahunnya pindah agama kristen agama islam,0
namanya sandir pecundang bubarkan urus ecek berani urus bantuan likuiditas bank indonesia rumah sakit sumber waras,1
giat bhayangkara pembina keamanan ketertiban masyarakat aiptu martin sembiring menyambangi thomas masyart desa labuhan labo pesan keamanan ketertiban masyarakat anti berita hoaks isu sara ujaran kebencian jaga persatuan kebersamaan situasi aman tenaga kerja asing dilaporkan,0
orang orang sumbu pendek protes prabowo menolak pemberian sumbangan orang orang rohingya,1
tolak peraturan pemerintah pengganti undang undang tolak rezim otoriter peraturan pemerintah pengganti undang undang pintu masuk lengserkan jokowi,1
gagal pm kegagalan merangkul cuap gagal pm contoh kelompok kemarin presiden aman,0
mampus jung ruby,1
tong kemana presiden dihina,0
berbicara katn ahmad dhani monyet babi anjing,1
cinta buta cinta mendengar fakta kotoran kucing coklat sependapat prof,0
mampus kalah ln gue,1
anjir salah tag gue jennie zumi lisa,0
apes beneeeer jadwal shift pagi besok off lusa shift malam sabtu badan cungkring ampuuuun,0
koruptor teroris pelanggar ham berat koruptor membunuh rakyat pelan rakyat miskin bodoh kehilangan struktur sistematis rakyat kekurangan gizi kelaparan dewan perwakilan rakyat sibuk korupsi,0
setuju dipasangkan jokowi setuju mencoblos pasangan,0
membatalkan keputusannya sikap syahrir berubah dicegah tokoh partai tionghoa indonesia teguh,0
bunga melati bunga bangkai,0
dibubarkan diusir yordania,1
presiden sistem perizinan berus terintegrasi diterapkan ratas presiden perizinan berus terintegrasi diterapkan,0
ahok orang penista agama,1
mengerti gue nikmatnya dimana orang orang seng desak desn diangkutan menyenggol bokong doang,0
bacot reza uruskan anak istrimu gara gara reply galau,1
gue sipit sipit mata barangkali warnanya beda,0
memasang jepretan racun tikus coba perhatikan rumah sisa mnan bersern sampah berceceran heran tikus tikus berkeliaran tikus masuk rumah tertarik bau mnan non,0
dungu km make gelang kejadian perkara intimidasi langsung km terlibat gelang dugaan bentuk konspirasi,1
kampungan nagita slavina reaksi ayu ting ting,0
pacaran agama muslim hindu buddha lucu,0
tragedi salah upaya komunis prabowo,1
tau jaman megtu korupsi jaman susilo bambang yudhoyono,1
pasangan calon gubernur il gubernur unggul inews debat kandidat malam,0
prabowo terhormat tampil orang cemburu kalah,1
jokowi mundur jenderal bantai pemilihan presiden,1
peang kesayangan kecintaan bolot sok pintar lemot gue,1
sarap bro,0
salah pendukung mafia koruptor penista agama gerombolan banci titot lakukan bidikan arah,1
ngawur rezim indonesia cina negara,1
retweeted uus rusdiana ciamis asyik ciamis salah kabupaten barat mendukung gubernur kang presiden il presiden ri keputusan ms partai keadilan sejahtera,0
perbedaan adi adi lihat gue bilang berengsek nyha,1
partai politik anu berus keras menjegal pengesn undang undang takut presiden mengeluarkan peraturan pemerintah pengganti undang undang menarik presiden kasih ancaman langsung diam ketok palu tok tok tok,1
ah bacot dasar sok alim manusia sempurna sok alim orang,1
gembok akun tebar data berkali kali main data data gembok akun sehari kali gembok akun payah cebong cupu,1
sipit bikin grup ber,0
intinya pas kampanye koar menghentikan melanjutkan menerbitkan peraturan gubernur munafik km dibilang kampret,1
kadang kemarin follow pengikut tertara unfollow follow geblek manusia,1
situasi lintas jalan gatot subroto gedung majelis permusyawaratan rakyat dewan perwakilan rakyat arah slipi terpantau ramai lancar,0
siang mi ayam kampus jual melayani menonton bareng jojo alah tersalip alah alah,0
hafiz tau cebong,1
ngentot yu rl gampang sange,0
jam segini ganti baju gembel rumn tandanya kemana,0
km lakukan patut km lakukan urusan pribadi sel,0
ayo penjarn koruptor sumber waras,1
sok peduli rohingya,1
blur kampret,0
cewek lelaki berengsek guys berengsek berbanggalah laki,0
rupiah anjlok ulah hidup menerima kebaikan isu negatif contoh isu partai komunis indonesia tax amnesti wassalam,0
diam kampang sakit kepala,1
sala cebong pintar nna kampret maju otak udang pakai gede badan doang rla petinggi kampret pinda haluan,1
partai demokrasi indonesia perjuangan mega bangkitkan komunis,1
sadar cacat hasil kerja tim besok day it time to sleep guys,0
babi sialll,0
income negara sektor bagus negara uang jokowi berhutang membangkitkan ekonomi bangsa terpaksa berhutang pemasukannya bagus simple,0
bilang kristen wudhu,0
orang mobil bergerak idiot windy kesal yoga peka kondisi perutnya diam menatap,0
congornya persis congor onta,1
babi anjing mampus kalah jatuh miskin deh bekasi sah,1
presiden uefa dukungan pengusiran gianluigi buffon michael oliver,0
dewan perwakilan rakyat as service,0
warga jawa lupn gantigubernur sudirman ida,0
lupa gereja bom minggu takut memilih beribadah,0
pelatih ribet kang bacot mulu kernnya,1
setahu moestopo dulunya kuliah rusia pulang huru hara partai komunis indonesia menambn beragama belng nama ingatkan salah,0
salam ustaz nak hukum bab jual beli seharian pembeli penjual jual beli,0
mending jokowi mundur,1
thomasubercup re tai,1
bodoh dungu idiot teknis mengacu nilai intelligence quotient psikologi,0
beking menarik solusinya memberantasnya nelayan asing tenggelamkan nelayan kalah tersingkir pengus,0
oi manusia homo,0
gembel fatwa tabi,0
abg sange telanjang masturbasi bokep indo cumtribute engas memek becek bugil ahok bokep barat cewek seksi pasukan,0
terpejam menunggu tamparan terima tamparan suara asing laki laki masuk pendengarannya eeeeeh membuka,0
mundur jokowi,1
partai sompret beli bubar pilih,1
queen coba memek,0
prediksi polandia kamis nas kop kepala ekor cat ncm shio ayam monyet ntwin nbbfs,0
salah janji jokowi tuntut pm cebong,1
kom menteri hukum hak asasi manusia md imunitas perdebatan undang undang pilihan kepala daerah ketok palu pendekatannya presiden mengeluarkan peraturan pemerintah pengganti undang undang md presiden mengeluarkan tanda tangan,0
merek yahudi israel us owner terbesar istilahnya suppoke pi,0
rannya bersumber kitab weda beda tafsir dasar kepercayaan percaya brahman atman karma reinkarnasi moksa nkl ritual raya sembahyang kebanyakan,0
bilangnya baca bilang seru alah pengirimnya kampang,1
negara perang didalamnya orang orang munafik syiah komunis berkuasa,0
bom peluk,0
cowok berengsek,1
turunkan jokowi rezim mengorbankan ahok,1
driver ojek menemui keluarga orang pesan ojek langsung tabrak bacotnya tukang ojek hina,1
gue gue doang dibeginikan tahunnya bangkai sinyalnya ganti telkomsel orang miskin,1
rezim mengeluarkan kebin memprotes penguasa pura pura mendengar pm mengkritisi,0
najis gue memilih oke lihat kali,0
jabar terbaik mudah meningkatkan ekonomi masyart disekitarnya congratulations geopark ciletuh selamat,0
pnh kerja asing bermanfaat diterapkan sekolah dominan aras,0
resmi izin program studi islam nusantara satunya program studi konsentrasi islam nusantara indonesia,0
terpilih mencalonkan presiden,1
negara ekonomi surat pemberitahuan tahunan republik rakyat cina us jepang utang sewot ri berutang berani utang negara dipercaya mengelolanya,0
beda pm kuliti tangkap cina,1
benaran cebong dasar intelligence quotient sekolem,1
sukses bajingan,1
berbeda institutionalized religion agama diarusutamn kultus kontrol agama arus utama islam majelis ulama indonesia menjaga sesat,0
sehat jalan jalan aktif lo menebar kebaikan presiden ri manggung kandang bosan ketemunya fadli zon,1
jokowi pencitraan pemilihan presiden perkara harga kemlan point prinsip disepti urusan pemilihan presiden metode kerja rezim jokowi,1
