tweet,hs
asing lini,0
meniru nabi lajur utama onta lajur kiri mobil motor,0
ganti presiden pemerintah menyepelekan intelektualitas rakyat,1
pikirkan ngilu sumpek push rank kalah anjing,1
hati hati dalamnya rakitan bom,0
semoga berkembang pesat,0
kemarin seng masuk kedai kopi empunya orang tionghoa berbeda alih alih kerja us segenap tern simpulkan aura peng,0
kader fitnah jokowi antek komunis contoh tau mainkan isu partai komunis indonesia,1
kodrat pecun dang pintar cari alasan,1
habis baca baca sejarah kelam bangunan kota tua sedih pembantaian kaum tionghoa tragedi pikir orang indonesia kej,0
surat pemberitahuan tahunan menunggu lengserkan perkataan hancur negeri presidennya,1
baiknya partai koalisi pendukung jokowi menyepti salah metode cpres jokowi menugaskan lembaga survei reputasi mengukur tingkat elektabilitas pasangan jokowi sern teratas,0
novel komisi pemberantasan korupsi sandi aman novel usut il gubernur sepupunya usut kasusnya anies,1
berengsek wondo joni dibs pekan menonton cctv,1
fitnah front pembela islam pecah ulah ahoker elektabilitas ahok tinggal kelojotan majelis ulama indonesia nu muhammad,1
penjarn cina kafir ateis ahok pemimpin babi tukang korupsi,1
bilang anjir potong batal,1
agama bilang kafir kafir korupsi pemeluk islam korupsi bilang oknum dasar bau busuk mulut,1
alg pilihan kepala daerah kalimantan timur tumbang komisi pemelihan berau,0
jancuk membicarakan manga menyambungnya lagu jakarta wota dgk,0
mampus,1
jam buta budek percaya sip,0
politisi bangsat berlomba siasat sesat pikiran rakyat ber posisi oposisi bejat fanatik giat rakyat penat politisi jert pantat monyet,1
kampungan,1
malam romantis mulu onta,1
antena ulang gue akui jilat prabowo tau jokowi beli keok,1
tentara nasional indonesia bergerak partai komunis indonesia bangkit merlela lengserkan jokowi gagal total memimpin indonesia,1
insinyur orde din syamsuddin amien rais amien muazin berteriak presiden diganti imam orang ucapan din syamsuddin terbukti,0
warga jawa dengar forum umat islam bersatu mengusir arik pilihan kepala daerah jawa hanbok mengusir arik telur ben kenyang nek ngelih sok bodoh,1
jokowi pemimpin terburuk utang ahli pencitraan maling kampungan jago bohong opresif anak partai komunis indonesia jongos cina komunis,1
topi ganti presiden,0
suka buang sampah sembarangan,0
maksudnya terbukti korupsi penistaan agama om bangsat tai maaf gue pakai babi ahok,1
mama gue restui kunyuk papa,0
dasar cebong diangkat mati,1
ulama ahli tafsir mengatn menyembelih hewan menyembelih hewan kurban salat idulfitri,0
video klip penuh bokong,0
bogel kunyuk hehe,0
jaman anies cebong akibat bir hapus,1
aturan salah biar lapor agama menyebut tersinggung agama,0
mengotot atribut nusantara islam atribut menohok jantung ide liberal syiah komunis,0
akun neopki komunis ateis berani muncul bak jamur musim hujan rezim rezim miris,1
heran orang auliya al almaidah ulama mengatn pemimpin kekeh bilang diartikan pemimpin padl,1
kristen nusantara hindu nusantara buddha nusantara katolik nusantara protestan nusantara khong hu tju nusantara nusantara koes plus,0
rezim istimewa tanah hancur,1
salat jumat rajawali citra televisi indonesia tub radikal menyentuh hati tub khotbah rasul silaturahim orang yahudi penyampaiannya oke,0
huawei memperkirn persen perusn beroperasi global mengadopsi kecerdasan buatan ai,0
indonesia mundur dipimpin jokowi,1
bantu memek mbak,0
haqqul dukung prancis hasil survei menangkan kroasia,0
solusinya lengserkan jokowi khilafah,1
koordinasikan kekuatan massa muslim mengepung kedutaan myanmar usir duta orang buddha biadab indonesia,1
mampus dimarahi hyung gue gue,1
tumben om ustaz on nooopst bang asing,1
antek asing komunis kapitalis,1
munafik hati benci benci sok damai damai gue viking anjing dilarang,0
berubah biu orang munafik perasaannya tau tameng kebgiaan memikirkan kebgian habisnya mending tidur,0
pengamat universitas negeri padjadjaran kritik prabowo jokowi blunder,1
dana investor asing deputi gubernur bi dody budi waluyo kepercayaan investor masuk portofolio domestik meningkat pasca kenaikan peringkat utang moody investor service invetasi investor ekonomi,0
coy kacrut penyedia,1
kabur datangi ulama jama ah menembaki gas air mata arah ulama jama ah membabi buta diam ulama fitnah bn teror habis ganti presiden,1
mari cintai produk membantu produk bersaing pasar global semoga menang gubernur sumatra utara menjadikan sumatra utara bidang peradangan,0
hayo ayo bajingan,1
setan siang siang teman setan menitip,0
besok prabowo mencalonkan presiden teriak teriak negara kesatuan republik indonesia harga mati dipercaya,1
anjir bolot budek,1
gubernur bank pecn uang dicetak,0
paul pogba selebrasi gol terdengar tiruan suara monyet,0
anjir kenap mencret maksudnya,0
lupa pendukung penista agama ahok,1
jokowi ahok hater pendukung prabowo,1
cebong dungu,1
eh oi rakyat susah zon teman dewan perwakilan rakyat situ waras oi micin,1
ditn paksa tuduhan berbeda mengerikan rezim jokowi,1
bangsa cebong bangga dibuatkan kaos logo pm kampret mengaku bangga,1
kondisi dimana tirin senang senang babi namanya,0
bersikap orang seiman selamat memperingati maulid nabi muhammad saw,0
memenangkan pilihan kepala daerah memiliki ketahui contoh simak deh video,0
keuntungan freelance writer chat,0
bani kampret dungu kontrak stop sanggup gaji ribuan karin sanggup beli alat super canggih gali emas ujung iyalah pemerintah,1
kitab suci agama koh nali,0
kecoa kebanyn mengerem septic tank bacot doang congornya joko,1
anies super gubernur isi kuliah maroko kandangkan markas komando anies top,0
abg adik yahudi,0
pengetahuan menggantikan persbatan patrick suka idiot kehilanganmu spongebob,0
batil ib ln diperangi ras apapun cina arab indonesia bulai yahudi kekhususan maklum elite quraisy il batil adil,0
pakai partai komunis indonesia memberangus ln politik,0
wedus gembel siram air bikin segar,0
ekonomi meroket hoaks,0
aduh berhenti mengucap cebong dongok fakta bukti,1
kampret kecoa hidupnya tai bikin penyakit,1
salah satunya nabi hud nabi hud tradisi arab islam padanannya tradisi ibrani yahudi,0
bukti nyata cina indonesia antek,1
gue curiga ahok kalah pemilihan kepala daerah konspirasi biar penduduk rta pindah meikarta gubernur kompeten,1
kristen namanya denominasi kelompok terakulturasi budaya indonesia wetan huria kristen batak protestan batak gpib kristen nusantara unik bhineka annya,0
sabar kerja lembur onta,0
berkeberatan jokowi antek orang papua,0
setuju bgia senang majelis permusyawaratan rakyat dewan perwakilan rakyat bubarkan gaji negara dikorupsi rugi,1
bslu kol tertinggi pelanggaran aparatur sipil negara pilihan kepala daerah seruji pilihan kepala daerah,0
manusia homo teriak manusia homo,1
negara kesatuan republik indonesia eksis terbebas serbuan tenaga kerja asing cina mari umat islam indonesia bersatu ganti presiden ganti presiden yuk presidenbaru,1
doktrin gereja katolik dogma maria diangkat surga utuh badan jiwanya katekismus mas lukas doktrin,0
bacot kunyuk bikin sayang ah,1
target turunkan presiden isunya il gantikan intinya jokowi konglomerat hitam tiarap peluang,1
berpolitik bicara islam berbalut budaya nusantara alah candaan semoga sadar amin,0
doktoranda bos bosan tai,0
dicari orang tuanmu malam hadir mimpiku,0
pi jamin peduli bos jatuhnya first travel booming pelakunya korbannya tenggelamkan orang indonesia budek diteriaki mengerti,1
anak pemberontak pemerintahan revolusioner republik indonesia perjuangan rakyat semesta prabowo,1
aduh cebong empati empatinya teman,1
tuak berengsek,1
teroris kafir komunis nusantara menista islam kitab nabi saw nn teroris hadir dimana mengesampingkan isu politik memanas,0
chaser top yoyakarta gay gerindra growl gay boy gay chaser gay indonesia gay indonesia lokal hot gay lokal gay top chubby guy gay bear gay bottom kontol sange gay yogyakarta gay asia gay fitness gayyogyrta gay asia,0
mencari pembenaran membuka pemain salah bela idiot,1
beli menghabiskan membenci anies sandi,1
fokus rambu jalannya ter cina rambu jalan pi cina,0
presiden berbuat salah berbuat salah presiden mundur bap,1
hantu limah munafik hem,0
sis request kat nak bodoh je last birthday natang sis happy bu tengok iphone al sis maksudkan iphone my kesalahan je pergi tukar minat apple iphone eeye,0
im garis ditabayuni beliau setipe dengannya ilmuku nol minus berharap islam diganggu umatnya diadu domba pemimpin beres,0
mengakui ustad bilang jancuk matamu picek bilang,1
hutang belanja pendapatan dewan perwakilan rakyat ri menyetujui anggaran pendapatan belanja negara dewan perwakilan rakyat ri mengontrol pengeluaran efisien efektif boros perangi korupsi bantu pemerintah baca rakyat indonesia nain pend,0
repost jokower ahoker sapi onta curut khilafah kecoa anjing kampret pentol korek bumi datar otak micin dibalas cebong turunannya bong cebong kolam butek mewek mengadu emak takut cengeng ah bong,1
je bumerang indonesia hormati dunia presiden mengembalikan pamor indonesia negara disegani dunia,0
modelnya munafik mainkan sara rakyat indonesia waras hasutanmu berpengaruh ganti presiden,1
anak buah mulutnya harap rakyat percaya,1
sipit,0
geblek juta,0
mu magriban ta,0
tai akun tau gue blok,1
koko badan kontolnya menantang ayo dicrotin kontol keras uuunncchh,0
dear dik selamat pencapaian semoga dipertnkan kasih kendor dik ganti presiden,1
mentalitas jamban pemikiran adat budaya elok terbiasa menampak kekok nak ubah buruk berr umbi peralihan zaman generasi,0
kampret kampret beraninya ml doang gue jolok mata tai bercanda guys,1
ulama karbitan mengomong memb kesejukan membaca belr kehidupan nabi biar tulalittttt,1
aktivis berhasil menumbangkan rezim orde kkn aktivis zaman now tujuan membubarkan partai keadilan sejahtera menumpang aktivis reformis penyusup bermental komunis,0
viralkan,0
segenap orang kristen membentuk keluarga allah berdiam tinggal roh efesus,0
jokowi komunis kapitalis,1
penjualnya kabur lapaknya ditutup kelemn belanja market place konsumen terlindungi klik tombol selesai was was kena tipu barang cacat undang undang perlin,0
sipit mbak onih,0
celengnya tereak cebong tolol padl celeng dungu buktinya ganti presiden yuk setuju bang gantinya tolol cari kocak no bang rock,1
kerja komunis zaman harto pura pura teman menyerang mnya waspada mudah percaya,0
presiden party mmsp berbahagia datuk seri menyambut kehadiran perdana menteri dewan juru beli kuala kangsar,0
tau prabowo salah geng menteri perjuangan rakyat semesta pendiri partai keadilan sejahtera anak tii pemberontak penghianat,1
bugis arabnya muhammadiyah ayah darah cina nahdlatul ulama ulama muslim bayi,0
negara oki buang islam lukman jalan damai timur,1
festival palang pintu gelar budaya mei sabtu minggu indonesia barat indonesia barat tutup jalan jalan raya kemang rta selatan informasi telepon wa,0
benda bodoh pergi beli mnan kejap mati perang tau staurl,0
calon presiden ri pintar pro orang otoriter,0
guntur romli al qur budaya sejarah,0
mewaspadai izin tambang menjelang pilihan kepala daerah,0
naluri banci hilang kawin,0
otak dungu,1
negara bikin legislasi mental mmah dijalankan hukum melarang ngewe resmi catet bikin dijalani,0
komedian keren gue bolot hebat bikin dialog menyambung dadn bingung ln bicara digakbolotin jago tektoknya allah long life bolot,0
blok cina rusia mensyaratkan berdirinya korban galau berat indonesia kerja hebat,1
presiden ulama menyejun suasana jelang pilihan kepala daerah serentak,0
azankan mulut jamban,1
hiruk pikuk pilihan kepala daerah pemilihan presiden sejatinya perseteruan antek asing barat asing asing pejuang negara kesatuan republik indonesia,0
lengserkan om dewan perwakilan rakyat kuasa rakyat berani lengserkan,1
and keturunan mix cina huhu,0
berkerudung transgender makan busuk seram kelakuan sundal bolong zaman now,1
pro to kampus pagi indonesia barat membs ekonomi chess competition ecc viii himpunan msiswa ekonomi pembangunan himpunan mahasiswa ekononmi pembangunan universitas tanjungpura reza wiranti andinia tino siln partisipasi,0
tenggelam kunyuk penghianat penghancur bangsa,1
rela munafik sejumput kenikmatan dunia membela penguasa zalim,1
allah kampret koneksinya,1
memi licik akun palsu menyebarkannya membully akun palsu membunuh karakter orang salah partai komunis indonesia orang ateis anti allah agama diperingatkan jenderal nasution mewaspadai komunis,1
mantap jokowi cak imin mobil jokowi cak imin acara jokowi cak imin pest join ber indonesia jaya jokowi cak imin join indonesia,0
anjr bacot pengantin tendang gaun dayezsah,1
kelakuan mantan berengsek olah kelakuannya dilupakan jokowi mantan tau khianati menolak luka,1
babi sial marah,0
era seyogianya undang undang md direvisi undang undang md keberadaan lembaga daerah dewan perwakilan rakyat daerah masuk ranah cengkeraman pusat pengisian anggota dewan perwakilan rakyat daerah masuk pemilihan nasional daerah,0
selamat berbuka puasa jalani hongkong jumat tunjangan raya tai top cat sekuatnya macau selamat meracik sesuai ai mu jp minat bom line inbox bosku percaya dipercaya,0
tsamara pengagum diktator soekarno,1
alien biru dilahirkan kota me ayah bundanya world tour disangka bundanya melahirkan alien kuku palsu lahir tanggal mei pagi buta berat kil,0
usir duta myanmar kumpulkan orang buddha indonesia lapangan terbuka adn orasi,1
sinting,0
pers mencerdaskan bangsa lgbt virus berbya islam virus berbya,1
il presiden susilo bambang yudhoyono saudagar lumayan sukses,0
suka nl memojok,0
siang mengikuti rapat terbatas dipimpin presiden tegaskan publikasi asiangames media lokal internasional kerja sukseskan event bergengsi mohon doa dukungan rakyat indonesia,0
terir bekerjalah abang,0
lompat ganti presiden,1
detikspo presiden jokowi soroti minimnya promosi asian games,0
bajingan inter tim top hebat lazio sampah,1
sok imut najis,1
merogoh kantung celananya mencari ponsel berwarna hitam mendeteksi pondok cina sial sekolahnya,0
bupati luwu timur hem thorig husler membuka rapat koordinasi forum kewaspadaan masyarakat gedung wanita simpurusiang malili rabu bupati himbau partisipasi masyart jaga situasi keamanan ketertiban masyarakat jelang pilihan kepala daerah serentak baca selengkapnya,0
kekaln soeharto prabowo meln opini dikaren keterlibatan konspirasi global as cina sekutu mendukung rencana csis elite katolik radikal konglomerat tionghoa menjatun soeharto,0
ngentot pacar hotel ngentot anak gede sange toket gede abg bugil tante kesepian memek becek tante bugil,0
diktator jokowi jongos organisasi jagal manusia nu mengandalkan kampanyenya kiai tukang tipu,1
butuh dunia internasional kemarin teriak antek asing asing asong kopar kafir,1
menemui rakyatnya ganti presiden,1
beli alot mengeluarkan sertifikat halal komponen mikro ditengarai bersentuhan berasal babi mengalami dekomposisi molekular bn atomik dicap haram najis mengalami proses dekomposisi molekular beli ramai,0
terlepas bom surabaya aksi teroris menyusn,0
henti membayangkan menit cocot gue orangnya not easy to talk suruh bercocot menit gue bilang hem hem hem doang,0
monyet songong,1
fist travel abu tour gelapi uang jam umrah melecen diam nini orang,0
potong tangan bajingan pemimpin munafik daerah munafik persa syariat cambuk orang pacaran doang,1
warga badui selesai memperingati tradisi seba pendopo pemerintah kabupaten lebak dilanjutkan bertemu gubernur banten idin halim sabtu sebabaduy,0
kader kader partai demokrasi indonesia perjuangan nasional demokrat anti islam ulama,1
mbok batuk orang didepannya ditutuplah congor,0
goblok selesai selesai nlbolehgoblongan,0
tn melayu hilang tsapp yahudi beli,0
jokowi mega mencalonkan presiden mundur bikin partai,1
merekrut gus nadir freemason kadung pemuka agama yahudi,0
sampaoli is sontoloyo pilih higuain icardi,1
mubazir kodrat ganti presiden,1
bolot,1
masyart pribumi san,0
gue gak tau man orang pi kepala but when kepala orang puas hati bodoh,1
posisi seks video tante ngentot bercinta kamar mandi tontong selengkapnya,0
subhanallah gubernur presiden presiden wali kota,0
calling for tenant paramabudaya telkom universitas selamat siang pasar budaya paramabudaya hadir yuk tertarik memasarkan produknya ribuan pencinta budaya langsung mendaftar pendaftaran,0
suka bisu menancap kali acuh memandangmu,0
bank asing atur perusn pemerintah atur perusn pemilik utang dibayar keuntungan freeport,0
gue daftar sanata darma yoyakarta nes katolik,0
agus budek mnya dengar,1
compile assignment sinting lengan baju,0
anjir lucu animasinya dewa,0
sungguh rezim jokowi sadis kekuasaan soeharto berpuluhan,1
matanya picek kebanyn eyeliner,1
kampret kecoak bikin ribut becus bani cingkrang,1
istimewa,0
pertandingan kroasia lawan rusia drama menegangkan menit skor nbn pendukung rusia komunis berdoa kemenangan tim kalah adu penalti kroasia,0
cocok bajingan,1
menyebut rezim anti islam semangat daftar calon pegawai negeri sipil maunya abdi negara anti islam,1
rizal ramli malu mencium jokowi jabatan menteri jokowi presiden dipecat menteri,0
usir keturunan cina pertnkan pribumi arab usir keturunan,1
bangsat pick maksudny oi menjilat anjing,1
enak gaji buta uang rakyat bermodal mulut sampah ri malu,1
bangga pas dilabrak nature republic dipameri kemana geblek,1
iyalah memangnya burik,1
orang munafik berbya buu semoga allah melindungi,0
tunggu buaya lobang,0
presiden tegaskan publikasi asian games,0
anies berbincang salat jumat erdogan warganet gubernur presiden,0
pernyataan resmi ketua front pembela islam adek armando adek armando demisi perbuatan kotor ujaran kebencian fitnah penodaan agama ulama,1
bikin minder pot pipi tumpah berengsek tirus gue sodori pipi gue biar tau definisi tembem kamus gambar ide dipuji hati,1
hadeeeh menyembunyikan bangkai irnya cium baunya ku ah,0
asyik pest presiden,0
jurus orang gila mengebut lalat ajian tatar bayu jurus kunyuk melempar buah dewa tidur pukulan matri ajian merogoh sukma siulan kapak naga api mengaln dewi siluman bukit tunggul wiro sableng sableng nuser nuser,0
mentari pagi agama kristen pagi umat nasrani lagu nasrani hadirkan,0
habis gelap terbitlah terang road to ganti presiden kartini,1
bacot gaya otak timpang,1
aseeqqqq oppa oppa sipit,0
kasarnya nean cocot ki,1
golongan halina in robi rekan frustasi golongan beli mangga campur sirup barium radium gue lupa belngnya gue golongan intel golongan ceri gendut puber,0
cina usir zaman belanda tukang penghianat,1
oh geblek auto nyanyi,0
rakyat dukungan komisi pemberantasan korupsi ri usut tuntas anies sandi anggota dewan perwakilan rakyat amien rais penguasa elite politik terlibat korupsi,1
untung pembantaian warga ahmadiyah jokowi saln,1
agama kedok menipu kali polisi berhasil menangkap sepasang suami istri dinilai menipu jemnya danib kabur uang rupiah miliar sosoknya,0
ustad pasar senin om hitung pencern penjual bang putih cina halal,0
bajingan rampok negara,1
oh cinta dukung presiden permadani ali sera cebong kampreter cantik,1
mbah saleh ketua dewan perwakilan rakyat budaya identik pertunjukan seni rta ketua dewan perwakilan rakyat bambang soesatyo bambang soesatyo pemerintah menjadikan,0
berbicara orang berak,1
artikelnya isinya ganti presiden,1
melanjutkan aher istrinya om om indonesia lawyers club kemarin ganti presiden oh mardani istrinya ketua partai keadilan sejahtera presiden partai keadilan sejahtera istrinya,0
partai demokrasi indonesia perjuangan nasional demokrat bicara ganyang partai komunis indonesia memble,1
belr slow living organik and vegan gaya hidup urban farming life manajemen prancis bikin sadar indonesia budaya budaya menerima balance syukur mas,0
disetiap universitas dititipkan mata rezim ngsin kegiatan msiswa aneh rezim,0
bantah photo membuktikan komunikasi menyambung pemimpin,0
teriak anti asing asing fadli zon berteman donald trump fadli zon bermental munafik,1
mata gue sipit orang korea wkwk keluarga my suara badan gue bilang ideal army love my everything my life my bts,0
rejim berpi rakyat,0
bagus harto perumn pakai indonesia bagus pondok indah bintaro jaya kota wisata pakai bahas asing residen desa hill hancur menghargai,0
anies sandi ter bongkar aslinya saracen,1
ketahuan main media sosial dungu dasar kecebong,1
baca tai spam kado,1
mundur sanggup makmurkan rakyat,1
selamat natal hehe dasar admin bolot,1
innalillahi ilaihi rojiun keluarga nahdlatul ulama berduka cita mendalam wafatnya kiai kholilurrahman ra lilur cicit syaikhona kholil bangkalan semoga allah merahmati menempatkan ra lilur sisi amin,0
aneh orang geblek habib rizieq shihab berani komentari anggap guru berani gendengnya tertolong deh habib rizieq dukung hina gurunya dasar fira,1
memek gatal ngentot pakai kontol keker,0
kuat menghadapi bacot sumpah kuat,0
pengungsi asing pengungsi asing dodol,1
mending bubarkan bikin lembaga anti korupsi paradigma bebas,1
septi karakteristik pribadi cermati kondisi faktual internal susilo bambang yudhoyono susilo bambang yudhoyono taipan harta melimpah,1
alfaati,0
butuh memek hubungi rupiah haneul terdekat,0
najis ml ml,0
for me kucing cacat is the precious gift event sempurna but they cute in their own way comel kucing,0
mantap mahmud kontol gue muncrat kapok tante bo,0
nuser nuser kunyuk ditindak pemerintah lemah nuser,1
sherlock holmes idiot grm bel bodoh detektif penemu telepon seorangpun menemukanmu jenius,0
lelahmu mengamini doaku lelahmu cacat ibadah semoga dunia surga,0
tuan guru bajang presiden nusantara for indonesia for rakyat,0
istilah kopar lapor partai komunis indonesia asing asing pria no pria sejatinya negara kesatuan republik indonesia,0
menteri soeharto homo,1
malu presiden korup era soeharto susilo bambang yudhoyono,1
menunggu hoshi sipit menunggu woozi mingyu,0
angkara komunis mustahil mthir pm,0
jokowi menunggu lengserkan konstitusi hehe,1
tuan guru bajang mendukung jokowi periode kaum bani micin kaum bumi datar kejang kejang,1
prabowo bermimpi ri mustahil mimpi siang bolong mas piyu sakit mimpi,1
halo selamat siang tinggal seputaran seminyak dapatkan produk jalan kunti street seminyak,0
berubah total anti asing asing cinta asing asing,0
menghargai saudara memilih ateis tipe orang ber meluruskan kebenaran dimata orang berbeda be,0
jaman susilo bambang yudhoyono korupsi besaran proyek mangkrak penak mbahmu,1
fokus kang menangkan pasangan asyik gubernur jabar abaikan asyikm aher indonesia,0
ahok pm pb dijadikan bn menyerang jokowi kelompok bani togel kang surat pemberitahuan tahunan halnya pemberian remisi napi teroris koruptor narkoba kang ahok bebas murni,1
presiden kampung sambut meriah tukul kampung sambut meriah gede sambut rakyat bangga rakyat indah berbudaya gede ganti presiden,1
komisi pemberantasan korupsi mimpi berantas korupsi orang sangka koruptor atasi,1
guru desa sei kanan deklarasi anti hoaks pilihan kepala daerah damai,0
kekayaan indonesia sern asing,0
prank level tai anjing,0
rohingya muslim rescued at sea off sumatra indonesia,0
bangkai mas,0
pasangan calon bagus pasangan calon kecenderungan konflik rumput terbuka sadar pt susilo bambang yudhoyono berkuasa memojon koalisi pendukung jokowi mata kakak,0
jual badan usaha milik negara migas energi beli freepokira bang jualan cebong cebong indonesia pintar lucu,1
gaji juta prabowo presiden juta pikir maju sekolah kerja giat menyalahkan jokowi ustad provokator,1
eh karcis parkir pegang ah tai serius mal,0
melarang ran komunisme sisi pemerintah membun pintu masuk wisatn komunis besaran negeri,1
menarik gacha dantori kampret dayaku habis,0
ronaldo pardede siswa kelas sekolah dasar katolik karya yosef,0
cewek jago ngentot berondong cakap bikin tante nafsu mencari berondong,0
aceh usir gubernur kalimantan manado usir anggota dewan rta mengusir arab mengusir cina asyik tren usir usiran,1
lgbt musnn golongan terlibat rasuah salah kuasa musnn bangsa negara bya dosa harap sibuk perangi lbgt tutup mata kemungkaran men,0
agama islam agama samawi berasal arab langit agama samawi dibangun berdasarkan yu tuhan perantara malaikat jibril nabi rasul ditulis kitab suci kitab suci alquran,0
rapat koordinasi pengembangan bandara plt gubernur jawa tegaskan kehadiran presiden ri purbalingga,0
tertib presiden,0
cepat hebat lambat membuatnya cacat stop comparing my self to other,0
maaf kang mengopi bareng fahri lari negeri,0
akui yesus kristus suka bikin orang percaya hidup miskin menderita hem berengsek tuhan,1
cpresnya gempar bani oposan penamaan juragan menggantikan cebong kampret ceritanya,1
berharap pertamina bersaing perusahaan minyak dunia negeri bertn direktur utama tanda nasibnya bikin teken proyek kilang minyak realisasinya cepat nasehat duduk manis bikin,0
raih gue matre bayarkan npadl faktanya dasar banci potong itunya fukonserawlex,1
jilboobs pintar sepong kontol hijab sange mengemut anu jilbab cantik coli colok memek bokep mesum viral hypertext transfer protocol,0
antek asing impoke cina pengusung partai keadilan sejahtera gern indonesia raya nurut partai gern munaspil ketua,0
indonesia vietnam,0
mampus om om,1
gereja kristen jawa gereja kristen ran penggunaan bercampur ran keen budaya lokal dirugikan merugikan,0
nyalinya gubernur indonesia teruji beliau berani meln konglomerat hitam gubernur berani rakyat berdaya ganti presiden,1
ganti jokowi prabowo,1
kristen nusantara beriringan budaya agama berjalan budaya lokal terlestarikan,0
masya all dungu pemn tahi jokowi pernn era negeri serusuh rupiah hutang ln aset bangsa jualkan pembangunan tol ambruk seper,1
aksi turunkan jokowi biar selamat indonesia malu mencalonkan presiden,1
bentar ulang unn kirimkan rombongan topeng monyet merayakan,0
pekerja seks komersial mencampur lepas kerudungmu ketahuan pekerja seks komersial baca twit fahri benci jokowi balas jokowi presiden dimaki fahri twit fahri penuh,1
jotef hitam berengsek,0
dasar gila,1
uang negara ustad sembako incumbent uang negara rezim bangsat,1
tradisi katolik perayaan ekaristi misa diadn nuansa daerah namanya misa enkulturasi bn imlek misa inkulturasi tionghoa,0
lucu woozi tuyul lucu tuyulnya,0
masuk kerja mencret capainya kemarin,0
tag kepolisian republik indonesia anjing tolol sumpah,1
,0
anak muda meluap luap semangat membebaskan fman konservatif ranah burhanuddin al helmy berjaya presiden pas menewaskan ustaz abbas alias,0
maksud domba idiot akun,1
