tweet,hs
kali dimana daerah transmigran kalimantan selatan bnrmasin cerita lulusan pondok pesantren saking miskin masuk sekolah negeri sekolah kristen nkt bungkus mie goreng,0
kartosuwiryo be like dipimpin presiden tunduk kepentingan asing asing ganti presiden,1
tugas umat islam indonesia berat tegn hukum lengserkan jokowi,1
alay tong kampungan,1
jarak alim ulama kelompok politik berus menciptn kesan citra presiden berjarak ulama fakta insya allah menang meln fiksi,0
lupn biarkan karam kapal munafiknya bangun jabar kapal bersih delete partai pendukung penista agama hati,1
keparat orang orang,1
ayo pancing antek komunis negara kesatuan republik indonesia menyelenggarn menonton bareng film pengkhianatan partai komunis indonesia,1
diejek monyet,0
prof katolik indonesia induknya konferensi waligereja indonesia kristen indonesia induknya pagi anggotanya kristen protestan huria kristen batak protestan maranata,0
uwm surabaya lembaga pendidikan katolik coba kik menyenangkan tau ramah calon customer sungkan,0
paul pogba selebrasi gol terdengar tiruan suara monyet,0
semoga dis najib lindungi allah ketan kaum kafir munafik memusuhinya amin robi,1
tau duduk bareng keluarganya vibe orang kaya najis,1
sompret mulu merayu,0
partai komunis indonesia soeharto menyingkirkan soekarno ditiru prabowo menantu,1
cashier indon mesti gelak padan babi berengsek,1
tau fiksi berkat penjelasan rocky sreg kitab suci katn fiksi kitab suci al qur tau pandangan ulama katn rocky,0
aduh tagar ganti kalender twit international association of athletics federations dasar onta,1
ketua dewan perwakilan rakyat budaya identik pertunjukan seni medcom id,0
badan penyelenggara jaminan sosial mengaku rugi perusahaan listrik negara pertamina rugi negara rugi anehnya presiden mengakui hebat kalah tukang pisang omzet triliunan dagelan,0
il gubernur daerah khusus ibukota rta selasa menghadiri sosialisasi meluncurkan aplikasi oyes pasar koja rta utara aplikasi pedagang lingkungan pasar jaya mengakses layanan pembelian antaran pekerjaan rumah,0
aliran dukungan pasangan tubagus tb hasanudin anton charliyan hasanah pemilihan gubernur pilihan gubernur barat bertambah pundi pundi dukungan perolehan suara kali budayn sunda kitsanah hasanah,0
sipit sipit in biar senang hati adik,0
najis niat flash sale barang dibayar hilang,1
biar sarap menambah,0
khofifah merupn menteri berprestasi kabinet kerja presiden jokowi bagus,0
bunga bangkai,0
hai jokowi ahok social media volunteer jil syiah jongos asing hati hati gerak gerik kembalikan media islam,0
peri rumah diperlakukan kasar mematuhi perintah tuannya peri rumah senang tuannya memanfaatkan celah apapun keuntungan kejam,0
pemimpin rakyat,1
ahok and bani serbet and wereng coklat memancing umat muslim marah iklanahot kumpulan orang sinting,1
khofifah beberkan bakti satya debat malam,0
menebar kebencian ahok mbak mbak tau terd,1
negara sesak penista pendl agama tentara nasional indonesia dicela simpatisannya,1
semarak ganti presiden presidenbaru,1
km korban bom bunuh,0
habis ngentot some hutan bareng tentara teman kenalan hehe kali some tentara nasional indonesia kekar,0
teman sekelas cakap imut sombong berteman orang cakap suka mengatur orang sekelompok mata pelajaran kesenian tugas irnya disuruh ngeit hiasan sen,0
pepaya buaya,0
minyak merek kalajengking racun kalajengking dungu dipelihara,1
perusahaan listrik negara dijual asing,0
pilihan kepala daerah dampak positif masyart indonesia pilihan kepala daerah dampak positif virn viral,0
donor darah indonesia barat selesai gereja katolik keluarga kudus banteng jalan kaliurang km banteng ngaglik sleman uddpmikotayk,0
picek bilang lucu,1
akun peler culun berlindung dibalik akun fan club,1
negara blusuk sumatra utara warta ekonomi,0
kampungan adrian nptl,1
modar,1
bisu terpaku lembaran mimpi tersentak denting memanggilku terbangun gelisah hatiku resah,0
mengalahkan tank fighter assassin edan rak waras,0
deh elegan sampean undang penulis istana mengundang busar buser terima kasih,1
oh kemarin lupa sarapan mangkanya sarap,0
allah ampunilah ksaln kebodohan keterlaluanku urusan ampuni dosa engkau muslim,0
muak enak jokowi end habis kriminalisasi umat islam,1
aldo tai anjing,1
julukan anies sandi gubernur wakil gubernur saracen,1
situ antek komunis,1
ntt maju mari perkataan ekonomi perempuan pemuda desa emi nomleni calon il gubernur ntt marhaen marianu semi ntt marianu semi semi front april salam jari partai demokrasi indonesia perjuangan,0
bagikan sekolah anu sekolah katolik gede suster teman sekelasnya muslim kristen buddha hindu konghucu chu adem ayem,0
jualan mulu asing partai komunis indonesia umat palestina,0
otomatis memilih il gubernur gubernurnya memilih ilnya bagus khofifah emil jawa timur,0
he decul orang terpukul han geng memutuskan kontraknya ent cina,0
yusril halang pembubaran hati lengserkan jokowi,1
menghidupi grup membernya wajib militer member asing promo,0
jawa timur anti hoaks pilihan kepala daerah damai deklarasi anti hoaks warga kebraon,0
korupsi era reformasi antek antek orde,0
kristen seandainya ahok masuk islam setuju identitas kartu tanda penduduk administrasi tertulis agama islam terserah deh hati batin isinya ahok agama islam beliau masuk pol,0
lihat penumpangnya dipenuhi tenaga kerja asing cina bahas indonesia inggris cc,1
bubarkan dewan perwakilan rakyat,1
kali menolak buka lemari mencari benang rajut merajut henti tas pouch clutch taplak bn teman guru murid ikutan dirin,0
tai era mas jokowi,1
bubarkan komisi pemberantasan korupsi gunanya komisi pemberantasan korupsi dipi alat politik pemerintah,1
cebong senang omongan berbobot kaya,1
tereak cina mengaca junjungan keturunan etnis,1
kroasia negara katolik kristen ortodoks serbia slovenia protestan bosnia islam yugoslavia potensial pecah,0
takut kena tai burung,0
indon but sialan bajingan,1
dik sorbejeh cak macetnya edan edanan persebaya arema dino minggu timnas kayaknya lak menukarkan tiket,0
adil prabowo calon presiden ku jokowi presiden ku prof wakil presiden ku hmmmmm,0
eropa slavia brothers ortodoks power melayu malay brothers islam power eropa fundamentalis kristen ortodoks garis keras melayu fundamentalis islam garis keras,0
om dengar salah warga negara asing nkl mia audina warga negara belanda salah,0
keparat anjing teroris,1
gila cimahi najis,0
kunyuk meributkan inan anak jokowi memakai,1
asing asing antek partai komunis indonesia yahudi kapitalis merangkap komunis,0
lt unduh bokep video msiswi pecah pern dosen gila ngentot,0
takut america yahudi,0
berengsek bentuk pengecualian tertindih selamat mu sempro semoga kaos boneknya bermanfaat,0
wartn ncarain setuju,1
matandebatrta anies sadis topengmu terbuka lebar malam biar warga daerah khusus ibukota menilai katn pengecut,1
antek asing respect kinerja presiden jokowi beserta rannya lanjutkan jokowi anjing menggonggong kafilah,0
keren umat buddha usir indonesia,1
cantik is in the eye of the beholder standar kecantikan international cacat buatku lesung pipi menambah nikmat uh,0
cebong kalutnya,0
dinda pertanyaannya sosial gue,0
diwariskan anak cucu ilmu pengetahuan kelestarian alam belr cintai alam,0
tomohon merupn pusat pembelran agama kristen katolik khusus berdoa meditasi bukit kasih suci indah tenang tomohon international flower festival nun,0
aduh aduh gembel dilarang masuk,0
lt kepalanya pening istilah psikologi membuatnya membuka mesin pencarian mengerti arti dibalik baginya asing membuatnya senang mengern tugas,0
lo kristen beli menyimpan mp handphone,0
lidah buaya,0
tolak hoaks sukseskan pilihan kepala daerah damai kota kediri,0
beda tingkat intelektualitasnya bertemu orang ganti presiden,1
persebaran ekonomi kemakmuran jamin diterapkan adil merata madura dijadikan pusat ekonomi syariat timur saudara makmur gus ipul mbak puti bersaudara makmur jawa timur bersaudara satria muda,0
curi samping lelaki sekolah agama,0
kasiter beserta musyawarah pimpinan daerah tinjau sasaran fisik tentara nasional indonesia manunggal membangun desa komando distrik militer sasaran tentara nasional indonesia manunggal membangun desa pembangunan unit rumah tipe pembuatan unit pendidikan anak usia kamp cina tua dibangun unit rumah kampung ketuapi unit rumah kampung serui laut pasir puti,0
kristen nusantara gerejanya gereja kristen jawa gereja kristen,0
akun sisa checkout minggu habis anjir belanja,0
goblok alumni sampah,1
ronaldo pardede siswa katolik santo petrus kelas,0
mengambang tai jir,0
memek basah mas,0
buddha membunuhi islam myanmar,1
rumah masjid rohingya dibr teroris buddha,1
imajinasi gue jebi modar ketabrak meteor,0
aktivis pencegn hiv aids menduga pekerja seks komersial elmo pindah jayawijaya,0
bodoh sial anjinggg maju setan sweater mansoura,1
duu istilah pepatah tiada kenal mk tiada sayang pucuk dicinta ulam berjodoh,0
juragan silit,0
bhayangkara pembina keamanan ketertiban masyarakat kepolisian sektor camp sambang warga sosialisasi anti hoaks menjelang pilihan kepala daerah,0
su pin siswi sekolah dasar katolik karya yosef kelas istrinya ronaldo pardede sah,0
alumni demo bang asing impo,0
admin ekonomi hutang negara defisit bocor pas pelran ekonomi belr bedanya uang kertas uang koin uang kartal uang giral,0
gus ipul mbak puti berkomitmen meningkatkan perhatian kaum anak gusipulputi,0
berhasil menyodorkan prestasi tokohnya prestasi partainya muncul aksi menjelek jelen ln kasihan manis bego diperalat syt kekuasaan,1
hijrahlah terlambat cebong,1
berlagak giln corak cuba mengorak bergerak ramai,0
gih kebun binatang kandang buaya,0
aneh rezim rakyat pintar mas bro terimsih media sosial,0
berniaga katering mnan tempn kursus hadir beragama hindu vegeterian kali sedin menu orang tunggu orang hormat,0
dewan perwakilan rakyat bubarkan fungsinya menghabiskan anggaran ladang korupsi uang mr,1
mundur maulah dipecat menguntungkan gatot lus,1
tedun tensi pilihan kepala daerah ulama menyatn dukung jokowi mencalonkan presiden rakyatmaujokowi,0
pi syariat islam irnya bergantung manusia pelakunya negara ateis korupsi minim plus hidup damai setera,0
ngewe ayo,0
bong dengar jeritan petani dengar jeritan petani garam bolot akut pemerataan maksud bong gue mohon segeralah bersihkan kerak otak lumpur,1
artis pilihan kepala daerah jawa timur artis kota timur kumpul musim pilihan kepala daerah artis dangdut mendulang suara off airmu fildan,0
kitab hina laporkan polisi munafik hubungannya mewaspadai cebong kafir mengakui mengakui islam,1
bertuhan jalanan buku sulung pengembara tegar iruljamain pengembaraan aktivis falsafah alam politik ekonomi budaya cinta bertuhan jalanan menemui booth dewan tun pbakl apr mei,0
terbantn goblok,1
negeri selamat syarat lengserkan jokowi jaga negara kesatuan republik indonesia selamatkan negeri,1
mentang berkuasa diambil bn kewenangan yudisial sarap,1
lesbi cel,0
jablay pro belr langsung pap tete pap tete,1
lakukan ahok sukmawati joshua ge pamungkas ramai mengandung unsur penistaan agama penistaan agama,1
kasihan warga daerah khusus ibukota php dilantik anies batalkan janji kampanyenya,1
usir buddha indonesia diam pembantaian,1
keluarga presiden indonesia ban keluarganya prioritas kisahnya,0
kali mencalonkan presiden kali gagal tolol namanya,1
sebutan kampret kejam arti simbolisnya benderang tidur siang kepala terbalik melek cari mangsa gelap malam,0
mbak mbak mas mas kebelng mengulas sejarah pancasila negara terbentuk pancasila partai komunis indonesia partai komunis indonesia berketuhanan,0
mari tonton partai kebangkitan bangsa partai kebelet ln ppp partai pepet presiden pemenangnya,1
masllah indahnya tokoh allahu akbar,0
situs sangiran luas km persegi ditetapkan unesco daftar warisan budaya dunia,0
kabur pemain dongok tribun kosong dipanjat ah payah kontol,1
ayah oku tangan kiri cacat alhamdulillah kerja handle bersyukur ayah istimewa,0
tergolong asing baginya untung tolong sesepuh pasar menggambarkan peta sederhana panduan baginya menelusuri lingkungan takut tersesat,0
kang aher berhasil kartu perlindungan sosial bandara internasional jawa barat meningkatkan ekonomi rakyat jabar pembangunan generasi milenial nyata,0
abg generasi micin hafal gesekan kontol memek nikmat,0
sitip sitip,0
lengserkan jokowi biar gobloknya,1
msiswa kocak modus rakyat indonesia juta orang sontoloyo,1
titit titit berhamburan,0
hyunjin kejar film hollywood lempar bom,0
lesbi menganggap salah salahnya cinta maaf normal tanggap lesbi gay bisexual kesaln hidup berdampingan orang dipandang sebelah,0
junjungan jam bilang gebuk jam sweeping partai komunis indonesia,1
muslim menteri agama ib jujur isi alquran,0
kang sudrt syaikhona didukung ulama barat insyaallah gubernur jabar sudrtsyaikhu no jabarasyik pilihanprabowountubar,0
eh partai komunis indonesia miband tinggal zaman jam besi mira,0
edan pbg purwokerto ngeles,0
kasihan cewek menonton bokep atlet buka baju langsung sange,0
ngentot enaknya crot,0
anggota dewan perwakilan rakyat dipotong,0
negara dipimpin fm mengelola negara lengserkan jokowi,1
chadli cacat mala dembele diganti cacat,1
komisi pemberantasan korupsi periksa gubernur cgub sumatra utara ijeck,0
ruhut prabowo strok fadli zon ruhut gila indonesia lawyers club prabowo menyerang,0
wooyyy anjing ibumu pelacur kelakuan bejat dasar anak haram,1
bn dibs showtime doang acara mluk kampret dihebohkan fan belas sinting,1
buku ls peranan agama moral pembangunan masjart ekonomi indonesia syafruddin prawinegara harga minat,0
njinggg bencong gaya pakai blok wa,1
ceramah kalangan internal pemuka agama mengkhutbn istilah kafir non muslim agama islam domba tersesat agama kristen dogma agama,0
cewek lelaki berengsek guys berengsek berbanggalah laki,0
provinsi gorontalo visi misi gubernur menjadikan sektor perikanan kelautan salah program prioritas peningkatan ekonomi kerakyatan dimana pembangunan sektor perikanan kelautan diharapkan,0
pulang mama pacarnya suruh main kesini alah anakmu tergila gila orang kuri,0
adakan mnya nyanyi district jablay,0
ampun adem saudari fungsionaris,0
headline transaksi tunai dibatasi maksimal rupiah juta ekonomi terganggu,0
freepotdk diganggu gugat rezim orde bikin perjanjian abadi,0
rg al alquran al alquran kitab suci yakinlah maksud ahok menista agama lo oi bohong dasar kafir,1
gubernur indonesia,0
besok prabowo mencalonkan presiden teriak teriak negara kesatuan republik indonesia harga mati dipercaya,1
ogah presiden kacung orangnya presiden kacung,1
rakyat curiga rezim anti islam,1
rakyat hidup susah rezim jokowi rusia,0
berak,1
lihat setan takut tau setan mencari saudaranya goblok ketik,0
memi rohingya serang,1
kadang umur merokok orang tuanya berbicara berbicara gue berbicara anjing kontol marah,0
mampus selamat bergalau ria,1
berani bilang isu saracen digoreng serang ln ln jokowi,1
kampungan pendukung agus harimurti yudhoyono hypertext transfer protocol over secure socket layer co gmezpoylsy,1
warga semarang prihatin kontroversi puisi gus mus,0
model seksi ngentot direct message gue pret detail fr bule,0
persetan bocah kontol sok kerad kecewa sekolah ganti nama sok pemes tong biar coba sekolah kernnya pacaran tidur sok sok bilang harga,1
layak bubarkan mari referendum rakyat bubarkan dewan perwakilan rakyat,1
setan perusak diet,0
laporkan fix gerbong,0
kampret,0
terima keputusan presiden partai komunis indonesia muncul gebuk,1
minggu digitasi minggu rektifikasi proses pembaruan pbb layouting pbb menyenangkan kp belr map info global mapper arcgis autocad dimana cacat apps,0
aduh mata gue sipit padl im not cina myself aduh sabar adikku,0
terima kasih gubernur pujiannya,0
islam pakai huruf gede tenang buta mata buta hati hilang nurani kau memilih semaumu memilih semauku adilkan kecuali mengerti makna keadilan,0
indonesia palsu tanah pelacuran,1
tim pakai us produce orang irnya titik tertinggi tim perform lancar cacat darimanapun tim bagus men,0
presiden jongos menunggu aba tuan cina dibantai muslim cina kafir,1
bani kampret otak micin om bud pemerintah mesti duit freeport habis kontrak om bud membantu,1
gue lengkapi videonya kitab suci fiksi penista agama bernama,1
gus dur bersikap pemimpin muslim ramah idealis mencintai perbedaan pluralisme keren,0
mantap,0
salah jokowi rezim diktator otoriter komunis kafir zalim organisasi papua merdeka,1
nama,1
komunis keren,0
untung presidennya jokowi beliau bandara mangkrak jalan terimsih presiden salam periode,0
kepala unit binaan masyarakat inspektur polisi mt hutasoit melaksanakan sambang pesan keamanan ketertiban masyarakat pilihan gubernur pilihan kepala daerah karyn bank rakyat indonesia ranting muara damenra silit kawan kawan desa hutanagodang kecamatan muara kabupaten tap utara,0
isu menerpa feminisme rasialisme bn lgbt film mulan frozen remake live action cantik and the beast salah kekuatan film animasi disney lagu bikin penonton sing along menyenangkan,0
seriawan hamid marah menilai presiden rannya berpotensi penghianat bangsa terkutuklah kelak pet negeri,1
rezim plonga plongo kacung cina plonga plongo dungu,1
bom jiah,0
jalan berdua sipit tinggalkan,0
gubernur bangga bangsa indonesia,0
added video to playlist,0
bangkai habis putus terngiang memandikan kucing eeeeeee,0
bikin menonton ikutan sarap dadan main gitar,0
jokowi anti islam diusung ln ln politik buzzer rezim,1
barometernya terang pilihan kepala daerah daerah khusus ibukota petna irnya tumbang kotak pemilih hasilnya gubernur memb rahmat,0
terdedah,0
ngeles om anies sandi,1
allah subhanahu wa taala pm toleransi dibuang belr toleransi keindonesiaan gabung sabang merauke,1
sedih pas siang lihat sendok pasangannya garpu taplak pasangannya,0
rezim anti islam anti ulama buktinya,1
cupu squad,1
setuju usir keturunan arab india cina zul,1
dokumen hasil tim pencari fakta munir hilang hilang nyali politik jokowi era mega,1
ayas kunyuk,0
bslu menyatn partai keadilan persatuan indonesia lolos memenuhi syarat mengikuti pilihan kepala daerah liputan sctv,0
presiden indonesia negara kokoh kuat ulama umara beriringan menjaga tali silaturahmi jokowiulamasejunpilkada,0
dicepatkan lo irnya jijik woi ikutan tn napas pas kejar kejaran,0
es degan negaranya kedutaan israel menjalin hubung diplomatik jokowi menjalin hubung diplomat es degan antek yahudi,0
salut keikhlasan bersede menghabiskan dana miliar,0
kunjungan anies turki tuai pujian ribuan warganet gubernur presiden selengkapnya,0
terkutuk,1
hebat mengukur kadar keimanan kadarmu lihat tergolong orang picek mata hatinya,1
orang gila gangguan mental orang logis,0
somad minum kopi starbucks mad somad minum kopi ayo entar gue tampari cocot biar monyong,1
ganti presiden calon,0
deklarasi pilihan kepala daerah aman anti hoaks warga panggreh jabon,0
teriak teriak jokowi diktator teriak hidup nyaman ironis gue,1
sinting pemain sepak bola jualan bn kimia,0
ujian sekolah sekolah dasar pendidikan agama islam pai,0
anjir fuck kontol kuda,0
islam nusantara taming komunis syiah liberal menghancurkan islam indonesia,0
partai keadilan sejahtera antek komunis,1
patung tugu menawar besanding lokasi simpang kampung kagungan ratu kecamatan tulang bang udik lampung tebakgambarim ooredoo,0
angkat tangan bergerak serius sumpah lucu,0
rezim pemerintah apresiasi sisi pekern rumah selesaikan semoga periode tingkatkan deh berani membenahi pekerjaan rumah,0
meng ulama mendinginkan situasi menyejun situasi presiden jokowi,0
ahli ekonomi dengar cetak uang inflasi rupiah harga cetaknya sesuai nominalnya admin mohon koreksi salah,0
ng memaki noob eh by the way out ena bang,0
kali angkat jempol isi pernyataannya tindnnya aksi tes the water ketahuan pembela agama sejati abal abal mendukung pernyataan,0
marah kasihan kerja keras bacot didiamkan kerja keras bacot bau mulutnya,1
oh lupa trimsih presiden barulah jalan negara terjamah aspal mulus pos lintas batas malu memalukan serasa surga,0
cont mendekati phoebe tatapan keanu terintimidasi ramah orang asing bertemu ilya gendongan hadapan tangan mungil,0
suruh munr mimik kencing onta nmunr munafik,1
diejek kafir komunis antek asing,0
merebut utang utang tukang tipu duit pinjaman dipi pencitraan somplak rezim,1
oh scamming urus bego orang butuh,1
orang tert gila orang tert waras,0
tangkap bunuh bajingan mengharap penegak hukum,0
eh bang perek,0
game diangkat film bagus coba assassin creed kacrut residen evil oke,1
pasal perkataan babi baca last twit,0
anis menang gurun pasir onta,1
jancuk,0
dongok menumpang rakyat kerjanya nyinyir,1
emak ku bilang ket kunti,0
patut ditunggu bani hoaks membangun ahok nelson mandela memalukannya ahok ditn lupa mandela mandela pahln ahok pemimpin suka marah,1
basmi memperhatikan orang onta,1
ganyang partai komunis indonesia keiban menjaga negara kesatuan republik indonesia pancasila,1
keren warung tegal pakai taplak mejanya,0
dipikirnya agama asli indonesia islam impor kristen impor hindu impor buddha impor yahudi impor bn komunisme impor impor aliran animisme dinamisme dipelihara aliran iliyah,1
anjir memikirnya mengocok,0
ku negeri favorit favorit minoritas minoritas muslim kristen katolik kelasku sepertiga,0
seni budaya,0
orang ahok jokowi dianggap menghina islam kepleset lidah bela agama diniatkan mengr ln politik agama alat transaksi politik memal,1
kuda onta,0
dasar cina goblok bayarkan kucing gembrot model begituan,1
seandainya membiarkan penyakit berkudis bertapak barah diobati amin utusan malaysia utusan online,0
halo skripsiku transgender coba cari website suara lgbt rta km yogyakarta km coba lembaga swadaya masyarakat kebaya good luck,0
bisu tau orang bisu roman tangan nak je beli kuih raya,0
even ustaz berserban berjubah putih drive cel tergolong golongan babi anak anak,1
serba mendadak peci mendadak ulama mendadak singgah pesantren mendadak sbah nabi kitab suci fiksi mendadak bela islam bawa perasaan salah kemana,0
media oposisi jokowi mundur negarn,1
siapppp menunggu cepat jokowi lengserkan negeri kacau balau,1
contohnya lihat bayi lahir cacat dilahirkan sempurna bayi tanda allah zalim hambanya allah tau sabarlah ujian allah,0
gue aslinya geblek suruh kasih saran kritik asli north sumatera offshore far bagus bikin penasaran gue cepat menambah narasi kali,0
aduh kesannya insensitive sis gede gede bom tempo asosiasi cadar negatif eh ketambn,0
kern bani tlembuk stres akibat jagonya nyungsep jabar jawa jawa timur,1
sinergitas menanggulangi terorisme badan nasional penanggulangan terorisme datangi kepolisian daerah bali rangka menyukseskan pilihan kepala daerah serentak tpan pemilihan wilayah provinsi bali badan nasional penanggulangan terorisme badan nasional penanggulangan terorisme datangi,0
men mensiv uhu kerasa mw brojol semoga langgeng tengkar bom bom car semoga panutan gubya,0
wayang golek semar keluarga hina dorna orang suka semar keluarga memaafkan perbuatan maaf langsung,0
matandebatrta cina babi ahok sok pintar ahok,1
susu kontol manis susu kental manis,0
cebong norak,1
memmi hadis sepotong mulutnya bau pesing pelri hadis air kencing onta,1
ups ngentot kontol kakak ngaceng,0
habis kerja tk rumah nasib bujang in mampus bini sangsi rumah bini no,0
benci cemburu seringkali bajingan mengoyak mengoyak isi hati,0
biar edan lil,0
malam salah,1
kecewa bisu,0
pas ditegur deh tau itupun matanya pakai sipit sipit menerka menerka menegur,0
tai kucing sirik mengganggu diam cuk,1
rajin salat berhijab hukumnya ib tau lesbi alasan tersendiri bikin orang pm perasaan perasaan memandang allah,0
solo susilo bambang yudhoyono jam kampungan bin udik parah,0
hancurkan partai demokrasi indonesia perjuangan beserta antek kumpulan kafirun munafik,1
babi ahok mengejek onta biar injek onta,1
presiden joko widodo resmi mencabut proyek daftar proyek strategis nasional play station network alasannya,0
,0
orang mengatasnamn muslim picik surat pemberitahuan tahunan yahudi,1
tolol,1
ngewe pantai kayaknya enak bro gay video gay lokal ngentot,0
menjelang pilihan kepala daerah anggota kepolisian sektor tegalrejo polisi resor magelang sambang dds tokoh agama,0
anjir mati listrik sepulau namanya euy,0
budaya sunda bikin msiswa asing jatuh cinta,0
irnya orang pintar gila mati matinya mati bersamaan lang insinyur ketua,0
rakyat pm hoaks golongan kampret rakyat pm kerja pemerintah dasar sampah,1
berisik jablay hebat,0
mending memberitakan menteri joko jokowi mundur gagal hadirkan pemerintah berkualitas minimal ber intelligence quotient,1
memangnya wilayah palestina kosong palestina salah propinsi kelifn turki usmani turki hancur persekongkolan yahudi mendukung pemberontn kemal attaturk,0
gubernur daerah khusus ibukota terhormat kasih saran tolong tpa sampah perbanyak apartemen rumah mal,0
berengsek boyfriend kuat,1
lnya pikir bacaan sadar sadar disadarkan menerima lgbt bacaan fan fiction mudah mengimajinasikan bias other bias deh pokoknya,0
rezim halal gara gara duit malu pejabat putus kadang terciduk blunder menabrak hukum parah rezim,1
pakai rempel taplak meja prasmanan biar seksi konsumsi,0
tuhan pilihan gubernur lari arab cong nelo bencong otak idiot hina hidup cong,1
dewan perwakilan rakyat daerahnya sibuk terima suap kandidat partai politik pendukung pilihan kepala daerah langsung menghapus,0
gue masanya noob,0
padl shua saudara jauhnya kunti oppa,0
bocah jaman now colok memek becek bncoli memek colok memek colok memek jembut memek becek,0
edan retweet,0
ganyang partai komunis indonesia perang terbuka generasi partai komunis indonesia umat islam,1
kader fitnah jokowi antek komunis contoh tau mainkan isu partai komunis indonesia,1
bego namanya internet aduh goblok,1
kasih kendor bubarkan organisasi masyarakat eh pemimpinya benaran umrah tenaga kerja indonesia,1
cinta kunci hati mencintai hormati sayangi nba cacat miliki pasangan sebisa menutupi bertengkar dijadikan api sekam bersyukur terima,0
gue tau tau picek swafoto,1
titit tititnya tamasya tai ah,0
mantap kemajuan binasa salam cebong mania,0
pets kucing anjing longstream niche salah pendapatan affiliate amazon terbesar niche kucing anjing jualan pengadilan negeri aksesori,0
eh ngentot marah,1
ruhut prabowo kebelet mencalonkan presiden komentar,1
kereta bandara tai ganggu jadwal kereta listrik,1
koruptor lindungi komisi pemberantasan korupsi bubarkan kemana negara pemerintah koruptor,1
