tweet,hs
cowok berus melacak perhatian gue lantas remen perhatian gue kasih khusus basic cowok bego,1
telat tau edan sarap gue bergaul cigax jifla calis licew,0
kadang berpikir percaya tuhan padl jatuh berkali kali kadang tuhan meninggalkan orang tuaku berencana berpisah memilih kristen anak ter,0
ku tau matamu sipit,0
kaum cebong kafir dongoknya dungu,1
bani taplak kawan kawan,1
deklarasi pilihan kepala daerah aman anti hoaks warga dukuh sari jabon,0
gue selesai re watch aldnoah zero kampret karakter utama cowoknya kena friendzone bro,0
admin belanja poterbaik nak ais kepal milo ais kepal horlicks cendol toping doket gerai ro mertuaku taipan kembar baby romantika bank islam senang,0
enak ngewe,0
gue jari gue ukur nyali bacot,1
banci kaleng malu nyungsep koe,1
belr ekonomi mestinya jago memprivatisasi hati orang aduh ironi,0
aktor huru hara prabowo lengserkan pemerintn jokowi nyata,1
bu guru enn jablay guru sekolah dasar kayaknya menikmati pecun guru,1
ln bicara gue intelek otak kencing onta gue mengakui hadis nabi sahih kafir menolak mnya ahlun nar,1
belngan pikiran ampas,0
ari beki rapi monyet,0
cowok gantle gantle namanya banci,1
alga mnr bom,0
anjing gue jarang mengambek takut gue gue budak cinta,0
noob peluang disakiti gede,0
joko widodo dinilai presiden terlemah sejarah indonesia jokowi memiliki modal dukungan politik ketidakmampuan pemerintnnya menghadapi situasi ekonomi,0
pelr kecamatan bilah hilir deklarasi anti hoaks pilihan kepala daerah damai,0
bandara udara internasional kertti dibangun gubernur ahmad heryn gunn anggaran pendapatan belanja negara pemerintah pusat insya allah beroperasi,0
gubernur presidennya rakyatnya,0
kernnya delay mulu setan,1
menurutku pintu sorga pintu sorga asli pintu hatimu modus,0
partai komunis indonesia muncul jelang pemilihan kepala daerah pemilihan presiden digoreng gosong,1
nenek nenek heran cebong bohong,1
islam nusantara produk jil dipasarkan gencar antek jil jil anti arab pro asing almarhum kh hasyim muzadi,1
habis sahur jam bayi nete lemas,0
emak suka sipit,0
kelakuan homo jaman now ngentot live blued gay video gvid lokal hangat,0
gue orang maaf gue orang palembang deh belr aksara kelak belr budaya palembang,0
pergi guardian training mentang gue gembel kaos flat shoes dijutekin bangsat malas belinya kabur gue matri,1
bajingan melukai lady menerima ganjaran seratus kali lipat sanji selamat ulang thpelautjkt,0
menolak berita hoaks sukseskan pilihan kepala daerah wilayah kota kediri,0
presiden ri jokowi kerja tulus ikhlas rakyatb rsam,0
edan tujuannya fabiano,0
mendalami al alquran bang mulutnya orang kafir bejat hina farhat abbas law,1
beda kewibnnya berwib gubernur indonesia masya allah,0
anjir kali lihat orang bego debat pilihan kepala daerah kerjanya menyerang karakter kecewa on empok silvy and agus debatfinalpilkadt,1
gubernur zaman now gusipulputi ganjar yasin djarotsihar hasananton kosterace nurdinsudirman karolingidot keanekaragaman budaya suku agama sesungguhnya kekayaan djarot hadapan peserta rakercabsu,0
islam lokalisasi kristen mas nusantaranya mas lihat gereja bandung pakai gamelan khotbah pakai bahas sunda huria kristen batak protestan nusantara,0
ciptn situasi keamanan ketertiban masyarakat menjelang pilihan kepala daerah kepala kepolisian sektor konang silaturahmi tokoh masyart,0
positif nse positif respon masyart cangkul impor garam impor beras impor jagung impor tenaga kerja impor esemka impor nurl,0
sembahyang mengadopsi tradisi lokal kern hindu istilah lahir tradisi ritus tunggal menyembah all,0
pendidikan bodoh larang agama biar orang islam bayar ahok sadar memilih ahok gila,1
ahok the best abaikan kaum kampret otak micin,1
otak tempurung meladeni ln dungu hehe,1
sss beritanya gerung susah mencari kostany bocor memicing mata bibir monyong kesamping suara ky nhn kentut politik kotor zaman bini pulang ky nhn ngeden dungu,1
pinokio umur tahunan ganti presiden,1
cerita silat lae kho merah muda oh indonesia liang ie shen penulis cina,0
benci umat islam,1
provokasi mayat politisasi agama penyebab kekaln pilihan kepala daerah daerah khusus ibukota cebong mendeskripsikan kekaln junjungannya for your information ahok pemilihan apapun kecamatan il etnis mayoritas,1
gue nete,0
wkwk bani lowo,1
tbur lahir penguasa rakyat ulama cendikia bn iblis makhluk alim beribadah beratus dilaknat hasud tbburnya ahli ilmu filsafat failosof mari demo sendi,0
orang suka konser konser boros,0
racun ulama mengatn hukum rokok mubah,0
susilo bambang yudhoyono presiden ri khofifah emil masyart no bagus khofifahemilnomer,0
kali gue penggemar korea pop mengomong teman gue idol gue banci homo,1
suka video kisah perseteruan bolot malih tongtong,0
budaya kafir bersungguh islam diendn,0
hem hem diam bisu coba rumput bergoyang,0
setan membisin was was kepadamu mintalah perlindungan allah qs al fussilat,0
ateis sibuk agama orang,0
lengserkan jokowi bangsat,1
selamat kartini ganti presiden presidenbaru,0
bajingan homo nhati anak kamar mandi laki biarkan,1
cocot,1
budaya indonesia,0
ngrin salat orang asing memecah belah islam,0
berbicara bangkai,1
memercayai negara ranah kes pembubaran sistem ber negara menjadikan negara republik komunis padl negara,0
menikmati kebin diusulkan partai komunis indonesia,1
seumpama orang cina usir paksa indonesia,1
bunda ngentot yuk,0
cina babi cina maling usir cina hypertext transfer protocol over secure socket layer co hip,1
karno anti asing beliau coba deh adakan konsensus anti asing pro asing kebo ohannya keliru tutup akun,0
proyek korupsi rezim susilo bambang yudhoyono,1
lihat ting petinggi negeri suka mencampur bahas indonesia bahas asing kali bicara,0
ab pribadi senang berkompetisi positif,0
kitab suci agama bilang om mendadlap,1
suka menutup mata ditutup tertutup gara sipit,0
muslim menistn kitab suci alquran alquran suku detik makna faktualnya umat islam makna tersirat fiksi,0
eh kasar kampang,1
bentar gue rilis album the onta,0
cebong bang,1
najis gue mentwit barusan he,0
transgender anjing,1
bintitan mengintip titit kucing,0
bawel bawa perasaan bolot bodor deh,0
gue menyarankan bacot maling ayat langsung to the point orang sepm teriaki kafir sesat liberal pemuja dukun bla beli hatimu puas deh,1
salah target ahok agenda utama lengserkan jokowi,1
kena tagar kepanasan ganti presiden,1
maju duit goyang pape duit nak maju kat bodoh,0
huria kristen batak protestan berdiri pecahnya kristen tolik zaman penn belanda namanya kristen protestan kristen tolik perpecn berdirilah huria kristen batak protestan kali tarutung,0
baca biar pintar jepang amerika cina utang tau,0
prabowo kalah menyebut bantuan jokowi pencitraan ratapan pilu,1
takut azan iblis,0
goblok bani cebong tukang tipu penjilat penguasa ketahuan gerakan dibayar pi nasi bungkus propaganda nasi bungkus gagal,1
cebong sewot,1
gern menekankan kerja keras total tingkatkan potensi bangsa,0
padl gubernur djarot mayoritas partai politik dewan perwakilan rakyat daerah pendukung ahok djarot payah,1
rezim rusak memperbaiki sistemnya sibuk cari kesaln ketemu komisi pemberantasan korupsi alatnya besok pemerintah berganti berulang engah selesai organisasi orangnya,0
orang orang menuding antek asing asing sesungguhnya bertepuk tangan,0
anti asing,0
selamat semoga berkiprah bn tingkat nasional,0
asyikm ulama,0
ketahui diketapang tenaga kerja asing asing perusn pt who tambang bauksit viral pemilihan presiden kerja era gubernur cornelis ilnya,0
anak pecun hobi zina,1
bom surat berharga syariah negara,0
istirt presiden momentum saksi telinga mata rapat pembentukan pacitan,0
house select committee on assassination hsca menemukan cacat investigasi fbi warren commission hsca menyimpulkan tembn konspirasi dalamnya,0
genap april digelar tan pemilihan presiden acara tahunan negara indonesia memilih presiden semoga senantiasa berjalan aman lancar amin,0
ian pantat,0
mengakuinya orang pintar beragama memangnya agama memperbolen menista menghujat orang orang bodoh orang maaf lahir idiot hargai ciptaan tuhan iblis pintar licik,0
pendaftaran calon presiden pemilihan presiden dibuka agustus normatif politikus partai demokrasi indonesia perjuangan pm ganti presiden,1
tolol tau pemerintah rezim komunis bobrok koruptor pimpinan sidang dewan perwakilan rakyat paya cebong,1
gue mantan mantan gue sedih kepikiran tidur lo gue anak berengsek laki,0
cina perusak bangsa usir setuju,1
ganti presiden konstitusional rakyat woiii plonga plongo kelakuan otoriter,1
mari wujudkan pilihan kepala daerah kota bengkulu aman damai coki adem heru,0
serius presiden jokowi islam nusantara kristen nusantara buddha hindu bn kong hucu nusantara,0
kebersamaan pernyataan moeldoko bukti istana takut kebangkitan umat islam,0
cowok jago drasex ngentot adik luvian,0
kroasia kafir tau blr kafir lupa kapling sorga,1
menteri soeharto homo,1
gue tau culun takut orang berubah perln buruk,0
perang salib kern afrika terbagi babilonia pemeluk kristen tobaco pemeluk islam,0
kejar setoran bangsat rupiah turun,1
semoga tindak pelaporan penista agama adek armando langsung ketua front pembela islam kh shobri lubis badan reserse kriminal markas kepolisian republik indonesia gambir rta pusat selasa indonesia barat perhaps,1
bangkai,1
onta mati kebanyn minum,1
ahok tng was was hidupnya,1
sul teng ekses akibat tersandera hutang cina ganti presiden presidenbaru tetapjokowiganti,1
pride yunani hyper keangkuhan harga kesombongan dikenal sebutan hubris vanity harga mengubah manusia sombong kesombongan manusia terkutuk dimata tuhan manusia mencintai,0
tujuan hati nlogiu menb hati tenang logika hatiku sedih ku cari ban wasiat beliau tinggalkan terasing asing mata manusia duhai,0
bertaji komisi pemberantasan korupsi era era komitmen pemberantasan korupsi surat pemberitahuan tahunan era susilo bambang yudhoyono,1
admin tolol partai tolol partai tolol orang tolol,1
ayu ting ting goyang hot raffi ahmad nagita slavina kampungan norak,0
video tenaga kerja asing malaysia mengutip pernyataan,0
ppp buru buru tolak wacana pilihan kepala daerah dewan perwakilan rakyat daerah,0
random pagi menyamper meja kerja pakai bedak biar mukanya bersih istri butek ku pakai air wudhu ku kristen,0
gue kampret,0
memek lonte disodok kontol gede,0
jokowi mundur tutup,1
berbicara mulut banci beli kaca lihat dirimu bro,1
amin racist nada dani nada ratna paiiit nada onta nada lobang anus takut oi oi kehabisan obat penenang,1
tunggu komando imam bejat cabul tai bir ulama dasar banj sempak,1
kabinet berantn pemecah belah persatuan rezim,1
ih mengakui pintar orang politik mengaca oi tampang orang bego,1
partai demokrasi indonesia perjuangan menang menekan perusn tambang target proyek impossible dilelang murah antek cina ntb contoh partai demokrasi indonesia perjuangan menang dasar bajingan,1
percaya mulut buaya mu bawang,1
susilo bambang yudhoyono prabowo menyatu meln mega jokowi peristiwa terulang dimana partai demokrasi indonesia perjuangan incumbent dikaln mutlak susilo bambang yudhoyono mega susilo bambang yudhoyono meln prabowo mk pemilihan presiden selesai poros pemilihan presiden mk salah ln,0
banci kaleng gatot gaduh gentleman mundur bersaing pemilihan presiden meln jokowi,1
bebal,0
terir indonesia negara populasi muslim terbesar dunia islam merupn musuh barat komunis menghambat agenda kepentingan obviously,0
umuh persib persib kunyuk,1
film muslim pilih ahok mati disalatkan dijamin laris,1
banu banu yahudi beda banu banu kristen suriah salah perbedaan banu yahudi pakai eloah elohim suriah pakai alah allah,0
eh muka merah cendol setan cuaca panas,0
pemberitaan saracen diframing katak sen tim prabowo anies sandi media menumpn sakit hati katak cebong ehe,1
giat bhayangkara pembina keamanan ketertiban masyarakat brigadir polisi manajemen berbasis sekolah sihombing rabu april melaksanakan sambang desa tatap muka memantau keamanan ketertiban masyarakat pilihan kepala daerah desa lobusiregar tepatnya rumah rudi panjaitan helman sin hotman sin,0
sayang perempuan status menempel laki laki aduh nagita slavina blak ayu ting ting kampungan viva,0
lupa kang umat katolik minoritas diperhatikan gubernur golongan golongan,0
cebong dibilangi kemarin mengeyel situ memaksa cebong,1
kelemn gerindra orang prabowo turun elektabilitasnya congor fadli zon surat pemberitahuan tahunan durno,1
selamat kartini kali dirayn maknanya kali,0
foto bisu memiliki arti susah diartikan susah diartikan putus,0
mengalaminya muncul grub wa bani abdi hadi mbu mek kenal orang,0
ayah pres badar nuqaba boe hebat bidang agama takut natural killer tegur member hambar orang jom gerak gern badan chubby,0
anak pekan mengilhamkan dasar ekonomi deb penggerak utama kemajuan ekonomi bandar beliau allah rahman tun abdul ds malaysia memilih hogohundi,0
sialn lapar presiden disikat,0
menasihati kali ugal rezim eh negeri keburu hancur ekonomi moral menikah kacaoooooo,1
ael silit kebelet dikasihani orang sayang media sosial gue sadar instansi kemarin gue ceritakan duuu,0
cacat,0
rakyat aspal beton solusi jitu mengurangi kemiskinan keahlian cebong tukang tipu cebong goblok ketulungan plonga plongo mengakibatkan optimisme ganti presiden,1
baca harun yahya membelot kubu yahudi freemason kadang suka percaya,0
maju ulama bergerak tokoh agama indonesia gus mus,0
,0
mukidi percaya mudah dib keras dib keras nama,0
kemarin hujat mengharap dasar bani kampret,1
penjelasan fitnah siln dibantah apollinaris darmn al alquran kitab sampah,1
monyet koloe dibilang saudara ogah hidupmu hati comberan,1
body lufra scrub bahan dasar lidah buaya melembabkan kulit bcya info body mass index,0
cacat bermasa,0
penganut bumi datar teori bumi bulat orang asing notabene musuh,0
becak warga binjai disita gunn tenda bertuliskan ganti presiden partai keadilan sejahtera meradang bukti pemerintah panik takut,1
jokowi mundur,1
musyawarah nasional alim ulama ppp semarang menghasilkan rekomendasi syarat kriteria kriteria calon il presiden mendampingi jokowi romahurmuziy,0
pencern gagal anak ekonomi,0
kafan berasal budaya yahudi umat islam mengklaim,0
rezim kendali negara cina komunis patron tunggal rezim anti islam jokowi,1
tanda pilihan kepala daerah pemilihan presiden,0
misi membangun masyart gotong royong toleran harmoni selaras nilai budaya barat luhur no jabarasyik asyikm,0
ketabn pasangan taufik puan nurliyana dicontohi jom sumbangan meringankan beban pasangan come on twitter do your berpikir badan standarisasi nasional bank islam nurliyana bosan abdul razif,0
tai doang belaganya selangit karma idol flop gue ket keras,1
celeng kangen gue,0
terangi negeri budaya yuk mengunjungi purwokerto mumpung even rakyat purwokerto,0
presiden dana taktis menggunn kepentingan rakyatnya program pemerintah program pembangunan infrastruktur kip kartu indonesia sehat sertifikat tanah perhutanan sosial bahan bakar minyak harga padat karya,0
amin allah timnya kinan pelatihan ular dapatnya sungai gede musuhnya buaya gue,0
maju memaki mama bolot,1
gerombolan kadal jidat gosong sukanya ribut gerombolannya salah pura budek dasar gerombolan cingkrang,1
gentarnya takut kafir,0
padl saracen akun kritis dianggap saracen aneh jokowi,1
bego teman gue najis kesal gue,1
kafir kristen ulah,1
tau bau baunya keciri sipit buluk,1
memegang mucikari,0
guru tk darma wanita persatuan desa plumbon porong deklarasi anti hoaks ujaran kebencian isu sarah mendukung pilihan kepala daerah damai,0
anjir seram mainnya begituan,0
kayaknya bank bilang jual uang asing tukar rupiah,0
onta yaman setahun gue deportasi,1
hati hati berita pilihan kepala daerah berbau hoaks madiun madiun today thmadiun kotrismatikmadiun tolak cukai ilegal kunjungi,0
anak cocot,1
ketahuan hoaks fahri ambil berita tuyg pembaruan tong sampah diambil screenshoot taunya berita,1
mantp direct message barisan serba bang,0
lebah suka bunga bangkai gue penasaran madu,0
indonesia mundur bentuk,1
dongok bilang hacker,0
blunder cebong protein energy malnutrition pusat alasan ham rakyat aceh kali coba datangi pemerintah bilang suruh hukum islam kaffah aceh dewan perwakilan rakyat,1
bangsat gue menyelam,0
dipancing pancing urusan penistaan berbicara pemman fiksi kitab suci,0
cebong kacung teman gue dungunya tulang sum buang energi debat,1
partai korupsi sapi goblok,1
sinyal kontol pemeliharaan niat login twitter doang susah open redtube setan,1
matanya kafir,0
facebook anjir lupa,0
beli bilang alah kontol,0
nikita mirzani pakai hijab berbicara cebang cebong fantasikan uh ah cokorers,1
tatapannya dialin arah enggan menatap pria mencurign kali gaduh suasana angie menemukan pria asing tidur sofanya kejadian,0
lahir berkembangnya gern komunis indonesia dipisn organisasi bernama indische sociaal democratische vereeniging,0
seizy calpis,0
terserah balasnya fokus kern mengern tugas proyek seni budaya setelahnya langsung dikumpul dipresentasikan bersyukur nilainya memuaskan kejadian proyek,0
blan bro,0
kelakuan bodoh masuk kategori perbuatan menyenangkan kelakuan sontoloyo menganggu persatuan bangsa kelakuan naif langsung bentuk intimidasi ulama kelakuan,1
monyet turun pemukiman warga cibadak sukabumi,0
kotor bgia warganya cebong mengerti,1
givey taplak meja menang the rich chenle,0
kebuka kebusukan kubu anies sandi menang ber prabowo berus cuci tangan,1
bodoh bang,0
orang bego bro ego,1
kementerian lingkungan hidup kehutanan upayn pemerataan ekonomi tora san hutan perhutanan sosial tribun medan,0
mahfud md berpaling allah subhanahu wa taala pemberang bangsa buang islam,1
orang bego kebanyn minum kotoran onta otak somplak,1
terkuak strategi kampanye tim pemenangan anies sandi,1
warga badui selesai memperingati tradisi seba pendopo pemerintah kabupaten lebak dilanjutkan bertemu gubernur banten idin halim sabtu sebabaduy,0
lembaga anti korupsi bubar sentuh kekuasaan giliran komisi pemberantasan korupsi partai demokrasi indonesia perjuangan partai politik penguasa pulang mengotot bubarkan komisi pemberantasan korupsi,1
mas menyudutkan salah agama bya rocky cerdik menyusun kalimat dgunn inti kasih tau pengertian fiksi ayolah mas,0
pendukung calon presiden gagal pindah on sibuk urus asing kabur uang rupiah sadar asing kabur uang didukung pribumi anjing mustahil asing pribumi diam disogok mental kacung,1
rabun budek gue menulis berbicara,1
bismillah nn sepo terkutuk,0
cebong ahoker cebong cebok,1
update status bikin tugas selesai jancuk jembut,0
muslim pejabat negara bertindak bangsa negara,0
ikan sembuh sakitnya terselamatkan bagus laik jual dipisah diseleksi ikan cacat permanen pemeliharaan kesehatan ikan ncc,0
pribumi sadari lihat kecuali cina komunis misionaris abaikan twit usir cina indonesia,1
presiden tuduh rezim anti islam berbuat negeri berbuat umat,1
manusia bangsat,1
cina mengenalkan wisata haram indonesia,1
prabowo partai keadilan sejahtera bib asyik dianggap antek prabowo antek partai keadilan sejahtera hidupmu dramatis,1
persbatan salah lovren bukti beda suku agama ras halangan membina hubungan umat manusia perbedaan warna tersendiri menjalin pertemanan terima kasih lovren salah favorit best friend forever bro,0
lae turun menurun ideologi partai komunis indonesia melekat jiwa,0
kesal merokok motor yn kadang pengap ditutup macet,0
maaf kunyuk bro enak rasan sebar hoaks maaf sebar hoaks maaf mesti sapu biar jera orang,1
halo warga rta il kepala dinas penanaman modal pelayanan terpadu pintu provinsi daerah khusus ibukota rta denny yu haryanto meili il gubernur provinsi daerah khusus ibukota rta membuka acara junior chamber international jci indonesia nasional event setiamelayanirta,0
perkuat jaringan gubernur menekankan menguasai state of the aknowledge merantau indonesia,0
pandangan tuan guru bajang agama politik,0
penyedia berengsek,1
susilo bambang yudhoyono presiden ri khofifah emil masyart no bagus,0
dungu orang ganti presiden tau mikiiiir,1
bokep cewek bispak bandung ngentot crot mengunduh full,0
kampret complain raga ditanggapi fuck,1
jablay grand theft auto maunya dijemput pakai mobil,1
lihat memek tante,0
kerjanya memusuhi islam bubarkan hati rakyat ber lengserkan jokowi kodok tukang pencitraan,1
melengkapi orang buktinya goblok,1
salah lifah rasyidin memerangi orang kafir orang orang munafik orang munafik,0
suka nete ujian nasional maklumkan,0
nek lihat match chelsea menang mudah manchester united embuh chelsea kacrut ki diprediksi,1
yli tentara nasional indonesia suruh uruskan sampah plastik,0
tirkan manuver politik kebin rezim semoga negara kesatuan republik indonesia tercinta amin,0
permadi arya melaporkan rocky gerung polisi serius kitab suci fiksi rocky pernyataan salah terhina tunggu penganut agama menganggap kitab suci,0
bajingan tengik,0
pakai buruh cina rakyat pengangguran dasar rejim kodok,1
,1
rupiah haneul cute padl pacarnya perek on retweet,0
bilangnya anti asing asing taunya,0
suriah sekolah radikal rakit bom pulang indonesia amankan,0
kadang hidup tai kadang berak orang bereskan tainya tangan,0
ih banci selotipan,1
kalah orang kalah,1
gubernur zaman now gusipulputi ganjar yasin djarotsihar hasananton kosterace nurdinsudirman karolingidot keanekaragaman budaya suku agama sesungguhnya kekayaan djarot hadapan peserta rakercabsu,0
cinta orde meng idola prabowo hary tanoe,1
menantang buka dadalah eh menyebut setanlah habis kamus ngeln kenegarnan joko widodo presiden ri stresssssss hati kena strok serangan jantung rakyat indonesia kehilangan badut politik merdeka,1
belah duren dungu cebong maaf,1
orang orang yahudi nasrani al kitab taurat injil mengenal muhammad,0
bubarkan hati front pembela islam,1
ahok verbalnya keras pelampiasan pelarian kelelakiannya lunak,1
bagikan teman kantor pelanggan bercadar langsung bilang bom menghela nafas,0
pantat menusuk ditusuk bo wa gay berondong massage boy gayrta gay yogyakarta gay tangger,0
diancam dibunuh presiden republik indonesia mas mesti lapor penegak hukum bertindak ancaman pembunuhan kepala negaranya,0
orang nyosor nete,0
ngewe,0
jebur cebur,0
partai keadilan sejahtera ulang balai kota rr berbicara mencalonkan presiden balai kota ganti namanya balai politik,0
melanjutkan rencana menyeret pengadilan ham pbb,1
kebin pengembalian barang konsumen barang rusak cacat produksi konsumen puas produk terhitung tanggal pembelian haus mini quiz hazid kunyuk ikutan nuser,0
kisah hidup muhammad lengkap diunduh,0
penn bumi indonesia hapus penn ekonomi budaya hasil bumi cina basmi negara kesatuan republik indonesia usir,1
we pipis onta tercecer mari bau pesing,0
kejadian teriak lantang pemerintah pro asing pas ditri bantuan asing bikin posko intinya mengompori keluarga korban pemerintah bilang,0
mari berjuang jokowi dilantik gentar takut mata benang leher ujung tombak perut surut lang bisu suara,0
monyet,0
survei metro televisi jokowi menang presiden menghitungnya mengalahkan salah judul maksudnya jokowi menangis sumber zie bajrie,1
,0
cuba tegak anime kari jozu no tgi san nak feeling feeling cinta monyet zaman sekolah throwback habis,0
serunya pesta budaya derau kutai kartanegara,0
kontaknya retweet kenalan tante jilboobs sange nini namanya tante dea,0
debat publik ng pembuktian pintar ruang demik pamer indah orang kekuatan kelemn egosentris namanya kekuatan menn,0
duduki istana negara lengserkan jokowi salam,1
hebatnya sibuk pencitraan baca,1
muslim menghinn iblis betina menista syariat,1
baby kafir buddha teroris myanmar,1
indonesia merdeka indonesia orang cina takbir allahu akbar,1
pengamat politik hanta yudha pasangan calon no nz jawa jawa gayeng jokowi,0
jongos penista agama ahok sok sok ngong sara majikan penebar sara astagfirullah tobat,1
follow beli katolik akun prof menambah san berbangsa terima kasih,0
bejat cabul pengecut onta,1
wibisono pencitraan jokowi disebarkan up media massa pro asing terkesan jokowi berhasil,1
adian gaya beruk supir tembak metromini masuk dewan perwakilan rakyat kampungan,1
km mainstream mengaartikan pintar pintar relatif tergantung dib kemana pengertiannya surat pemberitahuan tahunan pintar meng undeeestimate orang gue pintar komen rejim now pintar mangkrakan janji doang sok making,1
gue dongok,0
ih masak samakan sampah,0
gue terpukau ganti presiden,1
aspirasi lina sumedang calon gubernur jabar berantas perebut laki orang meresn kehidupan warga desa,0
yaelah chat uruskan mesum anggota dewan perwakilan rakyat diam nyata selingkuh pura budek bong otaknya,1
katn takut cina party dap bimbang fman dib,0
cermin pecah berkaca,0
langsung tag partainya berani banci,1
comel asing warna,0
islam menjadikan manusia idealis realistis kehidupan lupa keras beristirt,0
kristus anjing anjing jembut keparat picek tai pejuh siwuk kutang siwuk idiot keparat picek tai pejuh siwuk kutang siwuk idiot keparat picek tai pejuh siwuk kutang siwuk idiot keparat picek tai pejuh siwuk kutang siwuk idiot keparat picek tai pejuh siwuk,1
agama katolik menyebut tolik nusantara agama kristen protestan menyebut kristen protestan nusantara agama hindu menyebut hindu nusantara agama buddha menyebut buddha nusantara,0
berbasis teknologi digital presiden sistem jalan langsung digunn ramah ratas,0
perasaanmu menghibur cebong bgia presiden cebong tol cebong germo,1
resah presiden hidup penuh drama pencitraan main film televisi joko judulnya,1
agama kristen golongan darah nasal san fernando valley,0
buddha bunuh muslim myanmar,1
udi bangkai jerman ibadah,1
papa ketua fraksi rakyat setya novanto dewan perwakilan rakyat pecat ketua dewan perwakilan rakyat pecat dewan perwakilan rakyat,1
cina,0
hoaks kodok bi meroket sekop bangsat karbitan munafik ganti presiden presidenbaru tenggelamkanjokowikesungaisiak,1
ribut komunis bla bla emoh baca baca niat agitasi menyerang pemerintah pakai cari simpatisan,1
presiden jokowi berharap skema kerja pembangunan pembangunan,0
pemilihan langsung biar memilih presiden dewan perwakilan rakyat calon presiden biar kucing karung bikin mekanisme oke calon presiden ditentukan gubernur berprestasi maju calon presiden gubernur,0
vital inter bek kanan pembeda terir era maicon ambrosio kedatangan cancelo bagusnya nhmmmm kesimpulannya geblek ausilio,1
namanya agama munafik,1
